id,news_url,Title_news,Annotations,annotations_num1
politifact14885,www.breakingnews247.net/59bc13819a723/world-s-most-popular-candy-to-be-removed-from-shelves-by-october-2017.html,World's most popular candy to be removed from shelves by October 2017!,Fake_news,0
politifact1106,http://frwebgate.access.gpo.gov/cgi-bin/getdoc.cgi?dbname=111_cong_bills&docid=f:h3200ih.txt.pdf,Browse Congressional Bills,Good_news,1
politifact1678,http://abcnews.go.com/ThisWeek/video/supreme-court-vacancy-10344589,Supreme Court Vacancy Video,Good_news,1
politifact370,http://tonto.eia.doe.gov/dnav/pet/pet_move_wkly_dc_NUS-Z00_mbblpd_w.htm,U.S. Imports & Exports,Good_news,1
politifact15263,http://sciencevibe.com/2018/04/11/dying-78-year-old-cia-agent-admits-to-killing-marilyn-monroe/,Dying 78 Year Old CIA Agent Admits To Killing Marilyn Monroe,Fake_news,0
politifact13260,https://medium.com/@PolitiFact/politifacts-annotated-transcript-of-the-second-presidential-debate-b54f45edeb99#.8csw9x616,PolitiFact’s annotated transcript of the second presidential debate,Good_news,1
politifact15217,https://fellowshipoftheminds.com/2018/03/30/application-for-march-for-our-lives-permit-was-made-months-before/,Application for ‘March For Our Lives’ permit was made months before Parkland school shooting,Fake_news,0
politifact15645,https://www.youtube.com/watch?v=jC8F3gd5_XY,WATCH LIVE: Tim Kaine and Corey Stewart meet for first U.S. Senate debate in Virginia,Good_news,1
politifact14576,http://www.breakingnews365.net/59c36cdd7b326/washington-state-legislature-votes-to-change-its-name-because-george-washington-owned-slaves.html,Washington State Legislature votes to change its name because George Washington owned Slaves,Fake_news,0
politifact12924,https://medium.com/@GovGaryJohnson/theres-another-choice-5d1f14b742d5#.gsyzpehxp,There’s another choice – Gov. Gary Johnson – Medium,Good_news,1
politifact14769,http://americannews.com/busted-nasa-accidentally-destroys-every-climate-change-advocate-exposing-massive-truth-behind-antartica/,American News is under construction,Fake_news,0
politifact13677,https://newsbreakshere.com/breaking-meryl-streep-just-got-fired-major-project-lying-trump-2,BREAKING: Meryl Streep Just Got Fired From A Major Project For Lying About Trump -,Fake_news,0
politifact14514,https://web.archive.org/web/20170914182404/http://freedumjunkshun.com:80/mar-a-lago-is-missing-after-kushner-destroyed/,Breaking: Mar-A-Lago Destroyed By Irma-Jared Kushner Still Missing,Fake_news,0
politifact13942,https://web.archive.org/web/20160806033734/http://associatedmediacoverage.com/motorcycle-owners-required-install-75-mph-governor-january-2017/,New Regulation Requires 75 MPH Governor On All Motorcycles,Fake_news,0
politifact13193,http://minnesota.cbslocal.com/2016/07/09/philando-stops/,Philando Castile Had Been Stopped 52 Times By Police,Good_news,1
politifact14727,http://www.react365.com/5a014dd52a278/uf-requests-to-cancel-rivalry-game-against-fsu.html,UF requests to cancel Rivalry game against FSU,Fake_news,0
politifact14071,https://web.archive.org/web/20170322070001/http://truetrumpers.com/lindsey-graham-threatens-to-convert-to-democrat-if-republicans-dont-dump-trump,Lindsey Graham Threatens To Convert To Democrat If Republicans Don’t Dump Trump – True Trumpers,Fake_news,0
politifact182,http://www.gao.gov/new.items/d071195.pdf,US Government Accountability Office Report to Congressional Committees,Good_news,1
politifact14436,allnews4us.com/politics/whoopi-goldberg-humiliated-handcuffed-dragged-tv-studio,"Whoopi Goldberg Humiliated, Handcuffed And Dragged Out Of The TV Studio",Fake_news,0
politifact14947,usanewscentral.com/bill-clintons-hitman-confesses-on-his-deathbed-source-hannity/,Bill Clinton’s Hitman Confesses On His Deathbed (SOURCE: HANNITY),Fake_news,0
politifact15409,https://yournewswire.com/cnn-ratings-plunge-30-percent/,CNN To Permanently Close Its Doors As Ratings Plunge 30 Percent,Fake_news,0
politifact1467,"http://www.foxnews.com/story/0,2933,584664,00.html",Sen. Gregg: President Obama's Budget Proposal Is a 'Disaster',Good_news,1
politifact11699,http://www.cq.com/doc/newsmakertranscripts-4807408?0,comments at the CNN Republican presidential debate in Las Vegas,Good_news,1
politifact1313,https://web.archive.org/web/20090913221204/http://www.whitehouse.gov:80/the_press_office/Briefing-by-White-House-Press-Secretary-Robert-Gibbs-9/10/09,"Briefing by White House Press Secretary Robert Gibbs, 9/10/09",Good_news,1
politifact12418,http://www.nbcnews.com/meet-the-press/clinton-s-lead-over-trump-shrinks-3-points-new-nbc-n577726,Clinton's Lead Over Trump Shrinks to 3 Points: New NBC News/WSJ Poll,Good_news,1
politifact14238,dailybuzzlive.com/cannibals-arrested-florida/,Cannibals Arrested in Florida Claim Eating Human Flesh Cures Diabetes and Depression,Fake_news,0
politifact608,http://www.youtube.com/watch?v=XzZNP4tTfV0,Sen. Barack Obama's answer to meeting energy demands,Good_news,1
politifact10787,http://www.npr.org/blogs/itsallpolitics/2015/04/13/399415802/transcript-nprs-full-interview-with-sen-marco-rubio,Transcript: NPR's Full Interview With Sen. Marco Rubio,Good_news,1
politifact516,https://web.archive.org/web/20080610072007/http://www.newschannel5.com:80/Global/story.asp?S=8414824,McCain Campaigns In Nashville,Good_news,1
politifact1825,http://abcnews.go.com/ThisWeek/week-transcript-kaine-steele/story?id=10721384,'This Week' Transcript: Kaine and Steele,Good_news,1
politifact7506,http://www.paul.senate.gov/?p=press_release&id=727,U.S. Senator Rand Paul of Kentucky,Good_news,1
politifact13560,politicono.com/palin-calls-boycott-mall-america-santa-always-white-bible/,Sarah Palin Calls To Boycott Mall Of America Because “Santa Was Always White In The Bible”,Fake_news,0
politifact14301,https://web.archive.org/web/20170710041423/http://uspoln.com:80/2017/07/07/bachmann-white-people-suffered-last-8-years-blacks-couple-years-slavery,Bachmann: “White People Have Suffered More In The Last 8 Years Than Blacks Did During Couple Years Of Slavery”,Fake_news,0
politifact15533,http://dailyheadlines.net/burka-clad-woman-runs-over-baby-gets-away-with-crime-for-1-stunning-reason/,"Somali Immigrant Crashes Car Into Ohio Families Home, Killing The Infant At Home",Fake_news,0
politifact1307,http://www.bea.gov/national/xls/gdpchg.xls,Gross Domestic Product Percent change from preceding period,Good_news,1
politifact14190,www.veterantv.com/trump-removing-marines-from-the-navy/,Trump Removing Marines From the Navy,Fake_news,0
politifact809,https://web.archive.org/web/20081016082039/http://debates.org/pages/trans2008d.html,CPD: 2008 Debate Transcript,Good_news,1
politifact1783,http://abcnews.go.com/ThisWeek/week-transcript-holder-giuliani/story?id=10596448&page=4,'This Week' Transcript: Holder and Giuliani,Good_news,1
politifact10877,http://www.cbsnews.com/news/isis-ramadi-iraq-air-campaign-us-ground-troops/,Should ISIS' gains lead to more U.S. troops in Iraq?,Good_news,1
politifact4372,http://www.pbs.org/wnet/need-to-know/economy/this-labor-day-we-need-protests/11228/,"This Labor Day, we need protests",Good_news,1
politifact3892,http://www.youtube.com/watch?v=wyoZJUKL3wA&feature=youtu.be,Palin-Huey,Good_news,1
politifact736,http://www.state.gov/r/pa/ei/bgn/5375.htm#econ,The page you're looking for may have been moved or renamed,Good_news,1
politifact13619,http://www.cnn.com/2017/01/05/politics/border-wall-house-republicans-donald-trump-taxpayers/,"Trump asking Congress, not Mexico, to pay for border wall",Good_news,1
politifact13931,https://web.archive.org/web/20170314174618/http://wbn12.com/rosenberg-tx/new-star-wars-movie-filming-near-rosenberg-texas-large-number-of-extras-needed/,"New Star Wars Movie Filming Near Rosenberg, Texas, Large Number of Extras Needed – WBN 12 News",Fake_news,0
politifact14384,http://nymag.com/daily/intelligencer/2018/06/fbi-agent-peter-strzok-will-testify-before-congress.html,"Peter Strzok, FBI Agent in Texting Scandal, Will Testify Before Congress",Fake_news,0
politifact14548,https://www.house.gov/content/learn/legislative_process/,The Legislative Process,Fake_news,0
politifact14270,https://www.inverse.com/article/21717-leonardo-dicaprio-barack-obama-elon-musk-mars-trio-sxsl,Leonardo DiCaprio Tells President Obama That He's Going to Mars,Fake_news,0
politifact15492,http://flashnewss.club/trumps-dhs-secretary-confirms-they-are-preparing-to-arrest-sanctuary-city-leaders/,Trump’s DHS Secretary Confirms They Are Preparing To Arrest Sanctuary City Leaders,Fake_news,0
politifact11021,http://www.ams.usda.gov/AMSv1.0/COOL,Country of Origin Labeling (COOL),Good_news,1
politifact35,https://web.archive.org/web/20070825014950/http://www.mcclatchydc.com:80/iraq/story/18861.html,Iraq pullout could create chaos,Good_news,1
politifact6907,http://politicalticker.blogs.cnn.com/2012/10/12/transcript-vice-presidential-debate/,Transcript: Vice Presidential Debate,Good_news,1
politifact13682,https://www.whitehouse.gov/the-press-office/2017/01/27/executive-order-protecting-nation-foreign-terrorist-entry-united-states,Executive Order Protecting the Nation from Foreign Terrorist Entry into the United States,Good_news,1
politifact15554,https://conservativepost.com/maxine-waters-is-getting-criminally-charged/,Maxine Waters Is Getting Criminally Charged!,Fake_news,0
politifact11294,http://beta.criticalmention.com/app/#clip/view?16261823/token/01fcf225-63fd-4230-87ff-f018e928e80f,Critical Mention,Good_news,1
politifact14880,https://www.infowars.com/pier-39-terrorist-was-an-anti-trump-antifa-supporter/,Pier 39 Terrorist Was an Anti-Trump Antifa Supporter,Fake_news,0
politifact537,https://web.archive.org/web/20080618171108/http://www.barackobama.com:80/2008/06/15/remarks_of_senator_barack_obam_78.php,Change We Can Believe In,Good_news,1
politifact11882,https://medium.com/@CarlyFiorina/what-carly-is-doing-tonight-d53e747382ec#.6qz44w5un,What Carly is doing tonight – Carly Fiorina – Medium,Good_news,1
politifact14940,https://www.politico.com/story/2018/01/17/full-text-jeff-flake-on-trump-speech-transcript-343246,Full text: Jeff Flake on Trump speech transcript,Good_news,1
politifact6556,http://www.cbsnews.com/8301-3460_162-57500549/face-the-nation-transcripts-august-26-2012-rubio-priebus-barbour-blackburn/?pageNum=7&tag=contentMain;contentBody,"""Face the Nation"" transcripts, August 26, 2012: Rubio, Priebus, Barbour, Blackburn",Good_news,1
politifact13577,http://archive.is/DQqCx,ELECTORAL COLLEGE ELECTOR COMMITS SUICIDE TO AVOID VOTING FOR DONALD TRUMP,Fake_news,0
politifact15268,https://news.antiwar.com/2018/04/09/red-crescent-says-no-evidence-of-chemical-attack-in-syrias-douma/,THIS ARTICLE RETRACTED: Red Crescent Says No Evidence of Chemical Attack in Syria’s Douma,Fake_news,0
politifact14749,https://100percentfedup.com/just-wapo-reporter-broke-news-judge-roy-moore-story-criminal-history-faking/,JUST IN: WaPo Reporter Who Broke News On Judge Roy Moore Story Has A Criminal History Of “Faking” * 100PercentFedUp.com,Fake_news,0
politifact13557,straightstoned.com/pro-lifers-declare-ejaculation-murder-every-sperm-cell-life/,Pro-Lifers Declare “Ejaculation Is Murder: Every Sperm Cell Is A Life”,Fake_news,0
politifact15429,http://conservativetown.com/index.php/2018/05/13/actor-brad-pitt-trump-not-president-no-future/,"Actor Brad Pitt: 'Trump Is Not My President, We Have No Future With This...'",Fake_news,0
politifact720,http://my.barackobama.com/page/community/post/amandascott/gG5XWF,Organizing for Action,Good_news,1
politifact84,https://web.archive.org/web/20070911181319/http://pol.moveon.org/petraeus.html,MoveOn.org Political Action: General Petraeus or General Betray Us?,Good_news,1
politifact948,http://www.votesmart.org/speech_detail.php?sc_id=388220&keyword=earmarks&phrase=&contain=,Remarks of Senator Barack Obama An Agenda for MiddleClass Success,Good_news,1
politifact5410,http://www.cdc.gov/nchs/data/nvsr/nvsr60/nvsr60_01.pdf,Centers for Disease Control and Prevention,Good_news,1
politifact14840,http://inshapetoday.com/now-official-fda-announced-vaccines-causing-autism/,FDA Announced That Vaccines Are Causing Autism,Fake_news,0
politifact263,http://my.barackobama.com/page/dashboard/public/gGxqkb,Take action,Good_news,1
politifact13887,http://www.newslo.com/price-better-budget-cancer-patients-die-quickly/,Tom Price: “It’s Better For Our Budget If Cancer Patients Die More Quickly”,Fake_news,0
politifact15418,https://www.conservativestories.com/2018/05/21/just-john-kerry-facing-prison/,JUST IN: John Kerry Facing Prison,Fake_news,0
politifact12486,http://www.cq.com/doc/newsmakertranscripts-4901417?5,foreign policy speech,Good_news,1
politifact13905,http://usnnetwork.com/special-report-georgia-becomes-first-state-to-ban-muslim-culture-in-historic-move-to-restore-western-values/,SPECIAL REPORT: GEORGIA BECOMES FIRST STATE TO BAN MUSLIM CULTURE IN HISTORIC MOVE TO RESTORE WESTERN VALUES!,Fake_news,0
politifact14678,http://yournewswire.com/youngest-leader-george-soros/,Youngest World Leader Bans George Soros’s Foundations From Austria,Fake_news,0
politifact8085,http://www.realclearpolitics.com/video/2013/07/27/cnns_don_lemon_bill_oreillys_criticism_of_black_community_doesnt_go_far_enough.html,"CNN's Don Lemon: Bill O'Reilly's Criticism Of Black Community ""Doesn't Go Far Enough""",Good_news,1
politifact15048,https://conservativedailypost.com/trump-declares-globalist-soros-national-security-threat-using-obamas-2014-executive-order/,Trump Declares Globalist Soros As “National Security Threat”…Using Obama’s 2014 Executive Order,Fake_news,0
politifact673,http://bioguide.congress.gov/scripts/biodisplay.pl?index=M000303,"McCAIN, John Sidney, III",Good_news,1
politifact14213,https://www.unilad.co.uk/science/nasa-confirms-15-days-of-darkness-coming-this-month/,‘NASA Confirms’ 15 Days Of Darkness Coming This Month,Fake_news,0
politifact2450,http://www.youtube.com/watch?v=_YXqf_6ug54,Mourning in America,Good_news,1
politifact13978,http://alternativemediasyndicate.com/2017/04/07/evangelical-leader-says-oppose-trump-punished-gay-child-2/,alternativemediasyndicate.com,Fake_news,0
politifact1053,https://web.archive.org/web/20050507232712/http://www.ssa.gov:80/OACT/babynames/namesbystate.html,Popular baby names,Good_news,1
politifact13924,http://www.empiresports.co/colorado-rockies-baseball-team-to-sell-marijuana-brownies-at-their-concession-stands/,Colorado Rockies Baseball Team To Sell Marijuana Brownies At Their Concession Stands,Fake_news,0
politifact13475,genius.com/discussions/219349-Donald-trump-protester-speaks-out-i-was-paid-s3500-to-protest-trumps-rally,"Donald Trump Protester Speaks Out: “I Was Paid $3,500 To Protest Trump’s Rally”",Fake_news,0
politifact642,http://www.nytimes.com/2008/08/23/us/politics/23text-biden.html,"Senator Biden’s Remarks in Springfield, Ill.",Good_news,1
politifact15573,https://www.facebook.com/RealTrumpNation/photos/a.744441295687017.1073741829.735823829882097/1283240148473793/?type=3&theater,Trump Nation,Fake_news,0
politifact13561,https://web.archive.org/web/20161213021214/http://usasnich.com:80/breaking-putin-interference-could-give-courts-legal-right-to-make-hillary-president/,BREAKING: PUTIN INTERFERENCE COULD GIVE COURTS LEGAL RIGHT TO MAKE HILLARY PRESIDENT,Fake_news,0
politifact14243,https://web.archive.org/web/20170619144927/http://breakingtop.world:80/2017/06/15/libtard-hero-al-franken-forced-resign-disgrace,Libtard Hero Al Franken Forced To Resign In Disgrace,Fake_news,0
politifact6089,http://graphics.nra.org/ila/ILA_209_ObamaScorecardPDF.pdf,Cravaack Passes Amendment to Improve US Aviation Security in Opposition to Obamas Planned Disarming of Federal Flight Deck Officers,Good_news,1
politifact208,https://web.archive.org/web/20070829110221/http://hitwise.com/political-data-center/key-candidates.php,Top Presidential Candidate 2008 Websites,Good_news,1
politifact2318,http://www.youtube.com/user/harryreid2010#p/u/14/PlrQ1MiLkk4,Harry Reid,Good_news,1
politifact9512,https://www.youtube.com/watch?v=67ubjGrTipk&feature=youtu.be,"Joni Ernst ""Promises"" Ad",Good_news,1
politifact10903,http://www.businessinsider.com/estonia-efficient-tax-filing-system-world-2012-2,Estonia Might Have The Most Efficient Tax Filing System In The World,Good_news,1
politifact14836,https://web.archive.org/web/20171228192703/http://houstonchronicle-tv.com/breaking-trump-fires-deputy-attorney-general-rod-rosenstein-raising-questions-over-muellers-fate/,"BREAKING: Trump fires Deputy Attorney General Rod Rosenstein, raising questions over Mueller’s fate",Fake_news,0
politifact10423,http://data.bls.gov/cgi-bin/surveymost?ln,Top Picks (Most Requested Statistics) : U.S. Bureau of Labor Statistics,Good_news,1
politifact5321,http://transcripts.cnn.com/TRANSCRIPTS/1202/04/se.04.html,Transcripts,Good_news,1
politifact15031,http://www.breitbart.com/big-government/2018/02/07/food-stamp-enrollment-drops-4-million-one-month/,Food Stamp Enrollment Drops by Four Million in One Month,Fake_news,0
politifact6277,http://www.youtube.com/watch?v=Ud3mMj0AZZk,"Obama for America TV Ad: ""Firms""",Good_news,1
politifact2816,http://abcnews.go.com/ThisWeek/week-transcript-madeleine-albright-sen-lindsey-graham-sen/story?id=12143913&page=4,"'This Week' Transcript: Madeleine Albright, Sen. Lindsey Graham, Sen. Kent Conrad and David Cote",Good_news,1
politifact13038,https://www.facebook.com/OccupyDemocrats/photos/a.347907068635687.81180.346937065399354/1215787178514334/?type=3&theater,The numbers don't lie... - Occupy Democrats,Fake_news,0
politifact620,http://www.youtube.com/watch?v=xcfkmklTgDs,Obama campaign radio ad,Good_news,1
politifact2013,https://web.archive.org/web/20090628092209/http://www.azdps.gov:80/About/Reports/Crime_In_Arizona/,Arizona Department of Public Safety,Good_news,1
politifact596,http://youtube.com/watch?v=u0ffLMVc7mU,Barack Obama Challenges John McCain To Duel Over Taxes,Good_news,1
politifact14205,worldnewsdailyreport.com/bin-laden-is-alive-and-well-in-the-bahamas-says-edward-snowden/,"Bin Laden is “Alive and well in the Bahamas”, says Edward Snowden",Fake_news,0
politifact13957,http://proudleader.com/2-liberal-democrat-congressmen-arrested-planning-trumps-assassination/,proudleader.com,Fake_news,0
politifact1067,"http://www.foxnews.com/story/0,2933,529026,00.html",An Open Letter to 'All Barack Channel',Good_news,1
politifact181,https://web.archive.org/web/20011107072419/http://www.teamster.org:80/01news/hn_010731_3.htm,Teamsters Tout ANWR on Capitol Hill,Good_news,1
politifact11580,http://abcnews.go.com/Politics/full-interview-transcript-president-barack-obama/story?id=35203825,Full Interview Transcript: President Barack Obama,Good_news,1
politifact14258,www.smoaky.com/forum/index.php?/topic/161489-barrels-removed-from-clinton-property-contain-parts-from-3-missing-women/,Barrels removed from Clinton property contain parts from 3 missing women.,Fake_news,0
politifact14544,www.cnn.com/2017/09/13/politics/susan-rice-house-investigators-unmasked-trump-officials/index.html,Rice told investigators why she unmasked Trump aides,Fake_news,0
politifact769,https://web.archive.org/web/20080817004723/http://www.cqpolitics.com:80/cq-assets/cqmultimedia/flash/votestudy/index.html,CQ Vote Studies,Good_news,1
politifact14810,http://news.groopspeak.com/breaking-federal-judge-grants-permission-to-subpoena-trump/,BREAKING: Federal Judge Grants Permission To Subpoena Trump,Fake_news,0
politifact15655,http://politifeed.net/news/abc-news-joins-obama-to-ban-american-flag-lapel-pins-heres-what-you-need-to-know,"ABC News Joins Obama In Ban Of American Flag Lapel Pins, Here’s What You Need To Know",Fake_news,0
politifact667,http://www.senate.gov/legislative/LIS/roll_call_lists/roll_call_vote_cfm.cfm?congress=110&session=1&vote=00126,U.S. Senate: U.S. Senate Roll Call Votes 110th Congress,Good_news,1
politifact15271,http://mysteriousearth.club/2018/04/08/cia-release-documents-of-moon-moon-has-more-than-250-million-citizens/,"CIA Release Documents Of Moon, Moon Has More Than 250 Million Citizens",Fake_news,0
politifact13836,usaconservativereport.com/2017/08/breaking-leaked-picture-obama-dragged-judge-handcuffs-wiretapping-trump/,BREAKING: Leaked Picture Of Obama Being Dragged Before A Judge In Handcuffs For Wiretapping Trump,Fake_news,0
politifact14927,http://www.bbc.com/news/av/entertainment-arts-24934979/oprah-winfrey-the-butler-racism-and-obama,"Oprah Winfrey: The Butler, racism and Obama",Fake_news,0
politifact683,http://www.cbsnews.com/htdocs/pdf/FTN_083108.pdf,Interview with Rudy Giuliani,Good_news,1
politifact674,http://www.legis.state.ak.us/basis/get_bill.asp?session=25&bill=SB4002,Action for 25th Legislature,Good_news,1
politifact12017,https://youtu.be/uRqSUv_B7KI,Jeb Bush 2016 Same Resume Right to Rise USA PAC,Good_news,1
politifact14355,https://howafrica.com/oscar-pistorius-attempts-commit-suicide/,Oscar Pistorius Attempts To Commit Suicide,Fake_news,0
politifact1741,http://www.msnbc.msn.com/id/21134540/vp/36687523#36687523,"Outlook, Office, Skype, Bing, Breaking News, and Latest Videos",Good_news,1
politifact14026,politicass.com/fox-news-sandra-smith-everybody-see-united-airlines-passengers-behavior-not-genuine-american/,Fox News Sandra Smith: “Everybody Could See From The United Airlines Passenger’s Behavior That He Was Not A Genuine American”,Fake_news,0
politifact14417,https://web.archive.org/web/20170809163245/http://americantoday.us:80/2017/08/06/breaking-barron-trump-rushed-hospital-hospital-releases-statement-condition/,"BREAKING: Barron Trump Rushed To The Hospital, Hospital Releases Statement On His Condition",Fake_news,0
politifact502,https://web.archive.org/web/20070926214934/http://obama.senate.gov/press/070918-senate_passes_o_2/,Senate Passes Obama-Hagel Provision Aimed at Preventing Nuclear Terrorism,Good_news,1
politifact779,https://web.archive.org/web/20070820164107/http://www.whitehouse.gov/omb/budget/fy2008/outlook.html,"Budget of the United States Government, FY 2008",Good_news,1
politifact14818,thehill.com/policy/national-security/355749-fbi-uncovered-russian-bribery-plot-before-obama-administration,FBI uncovered Russian bribery plot before Obama administration approved controversial nuclear deal with Moscow,Fake_news,0
politifact14565,sportfella.com/breaking-fox-sports-cancels-nfl-broadcasts-players-respect-flag/,BREAKING: Fox Sports Cancels ALL NFL Broadcasts ‘Until Players Respect The Flag’,Fake_news,0
politifact13515,https://www.facebook.com/MillerForTexas/photos/a.1430872243801609.1073741828.1427314137490753/1934485643440264/?type=3&theater,Sid Miller,Fake_news,0
politifact14855,http://www2.alabamavotes.gov/electionNight/statewideResultsByContest.aspx?ecode=1000915,Alabama Secretary of State,Fake_news,0
politifact746,http://www.youtube.com/watch?v=iT-lxXsrgaE,"""New Energy"" Ad",Good_news,1
politifact13784,https://web.archive.org/web/20170301092001/http://amposts.com/starbucks-just-placed-trumps-photo-floor-every-customer-step/,Starbucks Just Placed Trump’s Photo on Floor so Every Customer have to Step On It….,Fake_news,0
politifact401,http://www.youtube.com/watch?v=cN10_6pyshQ,McCain: McSame as Bush,Good_news,1
politifact13823,http://pix11.com/2017/01/24/man-pardoned-by-obama-shot-and-killed-by-masked-men-at-halfway-house/,Man pardoned by Obama ‘executed’ by masked men at halfway house,Fake_news,0
politifact14085,usleader.net/index.php/2017/05/11/breaking-bill-oreilly-critical-condition-attacked-tolerant-liberals/,BREAKING: Bill O’Reilly In Critical Condition After Being Attacked By ‘Tolerant’ Liberals,Fake_news,0
politifact999,http://www.cdc.gov/flu/protect/habits.htm?s_cid=swineFlu_outbreak_003,Preventing the Flu: Good Health Habits Can Help Stop Germs,Good_news,1
politifact810,http://www.cnn.com/2008/POLITICS/10/15/debate.transcript/index.html,"McCain, Obama go head to head in last debate",Good_news,1
politifact679,http://www.cnn.com/2008/POLITICS/08/29/palin.bio/,"Palin: Pioneer, maverick -- and now game-changer",Good_news,1
politifact4130,http://www.msnbc.msn.com/id/43779830/ns/meet_the_press-transcripts/,"Outlook, Office, Skype, Bing, Breaking News, and Latest Videos",Good_news,1
politifact14785,https://web.archive.org/web/20171114110855/http://www.soutwest-air.com:80/?,Southwest Airlines 2017,Fake_news,0
politifact15319,http://docquery.fec.gov/pdf/613/201804159108155613/201804159108155613.pdf#navpanes=0,Federal Election Commission filing,Good_news,1
politifact13745,https://web.archive.org/web/20170217234839/http://liberalplug.com:80/2017/02/11/gop-official-says-america-needs-another-911-shares-_______________-trump,GOP Official Who Says America Needs ?Another 9/11? Shares _______________ With Trump,Fake_news,0
politifact14051,https://web.archive.org/web/20170506030914/http://states-tv.com:80/trump-warns-russia-over-jehovahs-witnesses-ban-and-urges-members-to-seek-asylum-in-the-us,Trump warns Russia over Jehovah’s Witnesses ban and urges members to seek asylum in the US,Fake_news,0
politifact14954,https://web.archive.org/web/20180125013854/http://www.thepatriotreport.net/82-year-old-who-killed-a-muslim-in-self-defense-gets-the-death-penalty/,82-Year-Old Who Killed A Muslim In Self-Defense Gets The Death Penalty,Fake_news,0
politifact14621,https://observeronline.news/president-trump-signs-executive-order-stripping-nfl-of-non-profit-status/,BREAKING: President Trump Signs Executive Order Stripping NFL Of ‘Non-Profit’ Status,Fake_news,0
politifact14376,http://dailyfeed.news/barack-obama-tweets-sick-attack-on-john-mccain-says-he-should-have-died/,"Barack Obama Tweets SICK Attack On John McCain, Says He Should Have Died",Fake_news,0
politifact15398,https://www.inspiringday.com/prince_william_may_not_attend_royal_wedding_leaving_prince_harry_without_a_best_man,Prince William May Not Attend Royal Wedding Leaving Harry Without a Best Man; Princess Diana Would Not Be Happy,Fake_news,0
