id,news_url,Title_news,Annotations,annotations_num1
politifact13936,mainerepublicemailalert.com/2017/03/24/breaking-autopsy-results-from-vince-fosters-exhumed-body-cause-of-death-to-be-changed/,BREAKING: Autopsy Results From Vince Foster’s Exhumed Body–Cause Of Death To Be Changed,Fake_news,0
politifact12945,https://medium.com/hillary-for-america/to-young-people-who-are-undocumented-this-is-your-country-too-e0184e858b40#.2uv6onq62,"To young people who are undocumented: This is your country, too.",Good_news,1
politifact201,http://query.nytimes.com/gst/fullpage.html?res=940DEFDD133AF933A25755C0A962958260&sec=&spon=&partner=permalink&exprod=permalink,"New York Officials Welcome Immigrants, Legal or Illegal",Good_news,1
politifact14426,www.theguardian.com/us-news/2017/aug/12/virginia-unite-the-right-rally-protest-violence,Man charged with murder after driving into anti-far-right protesters in Charlottesville,Fake_news,0
politifact4586,http://www.cbo.gov/ftpdocs/124xx/doc12461/2011_10_07_MBR.pdf,Monthly Budget Review,Good_news,1
politifact2281,https://web.archive.org/web/20100827015529/http://news.yahoo.com:80/s/ap/20100825/ap_on_re_us/us_nyc_mosque,"9/11 families, others rally in favor of NYC mosque",Good_news,1
politifact13720,ghanaweb.website/2017/01/30/donald-trump-signs-a-visa-free-travel-policy-for-ghana/,Donald Trump signs a visa-free travel policy for Ghana,Fake_news,0
politifact15362,http://revolutionradio.org/2018/05/07/democrats-go-full-tyranny-now-demand-nationwide-gun-confiscation-from-law-abiding-americans-at-gunpoint-of-course/,"Democrats go full TYRANNY: Now demand nationwide gun confiscation from law-abiding Americans… at gunpoint, of course",Fake_news,0
politifact14862,https://www.ravinderbhalla.com/about/,About Mayor Bhalla,Fake_news,0
politifact13576,asnowrose.wordpress.com/2016/12/20/breaking-crew-of-air-force-one-refuses-to-fly-obama-6000-miles-just-to-play-golf-buzzfeedusa/,Breaking: Crew Of Air Force One Refuses To Fly Obama 6000 Miles ‘Just To Play Golf’ – BuzzfeedUSA,Fake_news,0
politifact13934,http://usleader.net/index.php/2017/05/05/breaking-ken-starrs-plane-just-disappeared-way-dc-testify-hillary/,BREAKING: KEN STARR’S PLANE JUST DISAPPEARED ON HIS WAY TO DC TO TESTIFY AGAINST HILLARY,Fake_news,0
politifact14306,https://web.archive.org/web/20170806200608/https://world-politicus.com/2017/07/08/obama-goes-g20-summit/,Obama Goes To G20 Summit,Fake_news,0
politifact2714,http://www.youtube.com/user/dscclive#p/f/7/1kfaEJYg8uA,Indictment US v Vince McMahon and Titan Sports New Haven Register,Good_news,1
politifact421,https://web.archive.org/web/20080506120114/http://pol.moveon.org:80/mccain10/email.html?,MoveOn.org Political Action: 10 things to know about McCain,Good_news,1
politifact495,http://www.cnn.com/2007/POLITICS/07/23/debate.transcript/,Part I: CNN/YouTube Democratic presidential debate transcript,Good_news,1
politifact15416,https://www.justice.gov/opa/pr/attorney-general-sessions-statement-recusal,Attorney General Sessions Statement on Recusal,Fake_news,0
politifact13548,http://time.com/4523755/donald-trump-leaked-tape-impact/,"Donald Trump, Billy Bush: Interview Scrambles Race",Good_news,1
politifact1519,http://www.cbsnews.com/blogs/2010/02/23/politics/politicalhotsheet/entry6235624.shtml%27,"Harry Reid Says GOP Should ""Stop Crying"" About Reconciliation",Good_news,1
politifact4926,http://www.nytimes.com/2011/12/09/opinion/brooks-the-gingrich-tragedy.html?hp,The Gingrich Tragedy,Good_news,1
politifact14519,http://freedomdaily.com/muslims-plan-grocery-stores-bare-irma/, BREAKING Muslims’ Disturbing Plan Comes Out After Grocery Stores Go Bare To Prepare For Irma,Fake_news,0
politifact13854,https://zimbabwe-today.com/breaking-fbi-issues-warrant-obamas-arrest-confirming-illegal-trump-tower-wiretap/,BREAKING: FBI Issues Warrant For Obama’s Arrest After Confirming Illegal Trump Tower Wiretap,Fake_news,0
politifact11115,http://www.nytimes.com/2015/07/24/us/politics/inquiry-is-sought-in-hillary-clinton-email-account.html,Inquiry Sought in Hillary Clinton’s Use of Email,Good_news,1
politifact14556,http://www.breakingnews247.net/59b9b0078dc69/carnival-cruise-lines-will-now-offer-free-cruises.html,Carnival Cruise Lines will now offer FREE Cruises,Fake_news,0
politifact13807,https://web.archive.org/web/20161122152424/http://uspoln.com:80/2016/11/14/stephen-bannon-nobody-can-blame-beating-wife-love,Stephen Bannon: “Nobody Can Blame You For Beating Your Wife If It’s Out Of Love”,Fake_news,0
politifact14135,http://www.pewtrusts.org/en/research-and-analysis/analysis/2012/11/06/112-year-old-voters-in-north-carolina,112-Year-Old Voters in North Carolina?,Fake_news,0
politifact677,http://www.foxnews.com/fns/,Fox News Sunday,Good_news,1
politifact287,http://www.opensecrets.org/,"Data on Campaign Finance, Super PACs, Industries, and Lobbying",Good_news,1
politifact15262,https://sentinelksmo.org/breaking-greitens-accuser-admits-photo-session-may-dream/,Breaking: Greitens Accuser Admits Photo Session May Have Been A “Dream”,Fake_news,0
politifact14116,www.usatoday.com/story/gameon/2012/11/12/lance-armstrong-yellow-jerseys-picture/1699693/,Lance Armstrong's defiant Twitter photo shows him relaxing with seven yellow jerseys,Fake_news,0
politifact2205,http://abcnews.go.com/ThisWeek/week-transcript-odierno-chiarelli/story?id=11351927&page=4,'This Week' Transcript: Odierno and Chiarelli,Good_news,1
politifact15327,http://www.politifact.com/punditfact/statements/2018/mar/14/delta-flyinginfo/delta-targeted-online-free-airline-ticket-scam/,Delta targeted in online free airline ticket scam,Fake_news,0
politifact806,http://www.politico.com/arena/perm/John_Lewis_C42BBD6A-7821-4081-9870-082C08FF364E.html,The Arena - Politico's daily debate with policymakers and opinion shapers,Good_news,1
politifact15037,www.reddit.com/r/conspiracy/comments/7ww8j1/russian_source_behind_trump_dossier_killed_in/,"Russian source behind Trump dossier killed in Russian plane crash, Rosatom CFO also dead. : conspiracy",Fake_news,0
politifact2435,http://www.whitehouse.gov/the-press-office/2010/09/20/remarks-president-cnbc-town-hall-discussion-jobs,Remarks by the President at CNBC Town Hall Discussion on Jobs,Good_news,1
politifact14293,http://politicot.com/spicer-trump-legal-right-cancel-scotus-serve-pleasure/,Spicer: “Trump Has The Legal Right To Cancel SCOTUS Because They Serve At His Pleasure”,Fake_news,0
politifact15178,https://www.politico.com/story/2017/05/09/trump-presidents-carter-bush-clinton-238125,Former presidents walk fine line in Trump’s America,Fake_news,0
politifact3251,http://transcriptswire.cq.com/do/transcriptView?id=8293,CQ Transcriptswire > Login,Good_news,1
politifact1779,https://web.archive.org/web/20100513074658/http://video.foxnews.com:80/v/4186199/barasso-ready-to-question-kagan,Barasso Ready to Question Kagan,Good_news,1
politifact14920,https://www.ecfr.gov/cgi-bin/text-idx?gp=&SID=b5df8668c5d53fb99d5c5fd1e20c0ab0&mc=true&tpl=/ecfrbrowse/Title05/5tab_02.tpl,eCFR — Code of Federal Regulations,Good_news,1
politifact14507,http://babylonbee.com/news/isis-lays-arms-katy-perrys-impassioned-plea-like-just-co-exist/,"ISIS Lays Down Arms After Katy Perry’s Impassioned Plea To ‘Like, Just Co-Exist’",Fake_news,0
politifact3050,http://www.facebook.com/notes/sarah-palin/americas-enduring-strength/487510653434,America's Enduring Strength,Good_news,1
politifact57,http://www.kff.org/minorityhealth/upload/6069-02.pdf,"Key Facts: Race, Ethnicity and Medical Care",Good_news,1
politifact13773,https://worldnewsdailyreport.com/japanese-whaling-crew-eaten-alive-by-killer-whales-16-dead/,"Japanese Whaling Crew Eaten Alive By Killer Whales, 16 dead",Fake_news,0
politifact14856,www.usacarry.com/forums/politics-and-news/63339-chuck-schumer-s-steamy-affair-high-school-cheerleader-confirmed.html,Chuck Schumers Steamy Affair With A High School Cheerleader Confirmed,Fake_news,0
politifact15399,http://24trueinfoamerica.com/breaking-60-people-just-found-dead-in-ohio,BREAKING: 60 People Just Found Dead In Ohio,Fake_news,0
politifact13226,https://www.census.gov/content/dam/Census/library/publications/2016/demo/p60-257.pdf,Health Insurance Coverage in the United States 2015,Good_news,1
politifact2241,http://frwebgate.access.gpo.gov/cgi-bin/getpage.cgi?position=all&page=E1558&dbname=2010_record,Assistant professor of economics at the Gatton College of Business and Economics at University of Kentucky,Good_news,1
politifact1063,http://energycommerce.house.gov/index.php?option=com_content&view=article&id=1680:cbo-waxman-markey-costs-about-a-postage-stamp-a-day-saves-low-income-families-money&catid=122:media-advisories&Itemid=55,Energy and Commerce Committee,Good_news,1
politifact785,https://web.archive.org/web/20070613045339/http://obama.senate.gov/press/070322-obama_urges_ber/,"Obama Urges Bernanke, Paulson to Fight Foreclosures, Hold Homeownership Summit",Good_news,1
politifact15579,https://conservativedailypost.com/us-representatives-promise-implement-of-un-gun-control-plans/,US Representatives Promise Implement Of UN Gun-Control Plans,Fake_news,0
politifact2964,https://web.archive.org/web/20101217214909/http://www2.tbo.com:80/content/2010/dec/13/131756/news-channel-8-anchor-keith-cate-interviews-obam1/news-politics/,Obama addresses key concerns for Floridians,Good_news,1
politifact13816,http://theseattletribune.com/trumps-unsecured-android-device-believed-to-be-source-of-recent-white-house-leaks/,Information for the Nation,Fake_news,0
politifact1714,http://alexander.senate.gov/public/index.cfm?p=NewsArticles&ContentRecord_id=30000d32-784b-4a53-9cf5-53a1bf005777&ContentType_id=cc3ac18e-c52f-4861-b310-83ea6a7150c1&Group_id=303dc633-2307-45c8-ae71-4ba2ace2189b&MonthDisplay=3&YearDisplay=2010,"The Hill: Op-Ed: Go natural, go nuclear",Good_news,1
politifact15175,https://evanjenkins.house.gov/media-center/press-releases/rep-jenkins-opioid-crisis-funding-should-be-based-need,REP. JENKINS: OPIOID CRISIS FUNDING SHOULD BE BASED ON NEED,Good_news,1
politifact2624,http://www.youtube.com/watch?v=9SAwzrvGjIk&feature=player_profilepage,Michael Bennet for US Senate,Good_news,1
politifact8987,https://twitter.com/louiseslaughter/status/439092883166359552,Louise Slaughter on Twitter,Good_news,1
politifact15355,https://web.archive.org/web/20180503143610/https://rickeysmileymorningshow.com/1908839/black-men-arrested-in-philadelphia-starbucks-settle-for-2-million/,Black Men Arrested In Philadelphia Starbucks Settle For $2 Million,Fake_news,0
politifact13929,https://web.archive.org/web/20170310212116/http://thelastlineofdefense.org/breaking-nancy-pelosi-was-just-taken-from-her-office-in-handcuffs/,BREAKING: Nancy Pelosi Was Just Taken From Her Office In Handcuffs,Fake_news,0
politifact14063,http://rip.trendolizer.com/2017/04/breaking-conservative-icon-ted-nugent-killed-in-hunting-accident-1.html,BREAKING: Conservative Icon Ted Nugent Killed In Hunting Accident,Fake_news,0
politifact15402,https://www.facebook.com/JudgeJeanineFans/photos/a.110035152675347.1073741828.109955466016649/744041135941409/?type=3&theater,And we pay her a salary!.... - Judge Jeanine Pirro has Fans,Fake_news,0
politifact439,http://abcnews.go.com/International/wireStory?id=4662887,"Latest World News, Videos & Photos -ABC News - ABC News",Good_news,1
politifact11627,https://berniesanders.com/democratic-socialism-in-the-united-states/,Senator Bernie Sanders on Democratic Socialism in the United States,Good_news,1
politifact14112,https://web.archive.org/web/20170515100952/http://dailyusaupdate.com:80/breaking-clinton-foundation-cargo-ship-raided-port-baltimore-reveals-sick-secret,BREAKING: Clinton Foundation Cargo Ship Raided At Port Of Baltimore Reveals Sick Secret,Fake_news,0
politifact15108,http://www.trendolizer.com/2017/07/breaking-trump-removes-muslim-federal-judge-for-trying-to-implement-sharia-law-in-america.html,BREAKING: Trump Removes Muslim Federal Judge For Trying To Implement Sharia Law In America,Fake_news,0
politifact6657,http://www.bls.gov/ces/,"Employment, Hours, and Earnings from the Current Employment Statistics survey (National) Home Page",Good_news,1
politifact14454,https://web.archive.org/web/20170822021322/http://newsconservative.com:80/breaking-barcelona-terrorist-cousin-us-named-barack,BREAKING: Barcelona Terrorist Has A Cousin In The US Named Barack,Fake_news,0
politifact14887,https://proconservativenews.com/shaquille-oneal-says-trump-is-possibly-the-best-president-of-the-president-of-all-times-ever-he-is-not-afraid-to/,"Shaquille O’Neal Says: ‘Trump Is Possibly The Best President Of The President Of All Times Ever, He Is Not Afraid To…’",Fake_news,0
politifact160,http://www.senate.gov/legislative/LIS/roll_call_lists/roll_call_vote_cfm.cfm?congress=103&session=1&vote=00011,U.S. Senate: U.S. Senate Roll Call Votes 103rd Congress,Good_news,1
politifact3428,http://www.ssa.gov/history/nestor.html,Social Security Online History Pages,Good_news,1
politifact74,https://web.archive.org/web/20070915144031/http://www.kff.org:80/insurance/7672/,2007 Kaiser/HRET Employer Health Benefits Survey,Good_news,1
politifact6842,http://www.cnn.com/2012/10/03/politics/debate-transcript/index.html,Transcript of Wednesday's presidential debate,Good_news,1
politifact216,http://www.fsis.usda.gov/OPPDE/larc/Policies/Labeling_Policy_Book_082005.pdf,Food Standards and Labeling Policy Book,Good_news,1
politifact1755,http://abcnews.go.com/print?id=10532649,"'This Week' Transcript: McKay, Napolitano, Salazar and Allen",Good_news,1
politifact13698,http://trueamericans.me/barrack-obama-will-be-on-new-1-dollar-bill-2017,trueamericans.me -&nbspThis website is for sale! -&nbsptrueamericans Resources and Information.,Fake_news,0
politifact15367,http://nyeveningnews.com/2018/05/08/pope-francis-gun-owners-cant-call-themselves-christian-anymore/,Pope Francis: Gun Owners 'Can’t Call Themselves Christian' Anymore,Fake_news,0
politifact3221,http://politics.blogs.foxnews.com/2011/02/11/romney-cpac-excerpts-its-all-about-jobs,Romney CPAC Speech: It's All About the Jobs,Good_news,1
politifact14835,http://www.thegatewaypundit.com/2017/12/facebook-picks-sides-alabama-senate-race-shuts-gateway-pundit-breitbart-reports-discredited-allred-accuser/,Facebook Picks Sides in Alabama Senate Race=> Shuts Down Gateway Pundit and Breitbart Reports on Discredited Allred Accuser,Fake_news,0
politifact6646,http://www.politifact.com/truth-o-meter/statements/2012/aug/15/stephanie-cutter/ryans-plan-includes-700-billion-medicare-cuts-says/,"Ryan's plan includes $700 billion in Medicare ""cuts,"" says Stephanie Cutter",Good_news,1
politifact14500,our.news/2017/09/10/breaking-clinton-foundations-sends-water-to-houstonfor-7-a-bottle/,Clinton Foundations Sends Water To Houston For $7 A Bottle,Fake_news,0
politifact14776,http://yournewswire.com/pope-francis-jesus-metaphorical/,"Pope Francis At Mass: ‘Jesus Is Metaphorical, Not Literal’",Fake_news,0
politifact129,https://web.archive.org/web/20071020022110/http://action.getourtroopsout.com:80/page/content/candidatesonnoresidualtroops/,Candidate Comparison,Good_news,1
politifact15591,https://yournewswire.com/broward-county-sheriff-fired/,Broward County Sheriff Fired For Lying About Parkland,Fake_news,0
politifact15137,https://www.rollingstone.com/music/news/miley-cyrus-donald-trump-is-a-fking-nightmare-20160302,Miley Cyrus: 'Donald Trump Is a F--king Nightmare',Fake_news,0
politifact498,http://www.youtube.com/watch?v=ljVB-tim2Rw,Obama Criticizes McCain on Lobbyists,Good_news,1
politifact212,http://www.mass.gov/legis/laws/seslaw04/sl040149.htm,Session Law,Good_news,1
politifact8557,http://cq.com/doc/newsmakertranscripts-4375816,Rep Jan Schakowsky on MSNBC,Good_news,1
politifact384,http://www.youtube.com/watch?v=3gwqEneBKUs,john.he.is,Good_news,1
politifact14166,forums.spacebattles.com/threads/%E2%80%9Cgay-people-should-wear-specially-colored-clothes-to-warn-straight-people%E2%80%9D.362660/,“Gay People Should Wear Specially-Colored Clothes To Warn Straight People”,Fake_news,0
politifact13244,https://medium.com/@PolitiFact/politifacts-annotated-transcript-of-the-second-presidential-debate-b54f45edeb99#.6sodpyhkw,PolitiFact’s annotated transcript of the second presidential debate,Good_news,1
politifact15191,http://www.foxnews.com/us/2018/03/16/ohio-student-suspended-for-staying-in-class-during-walkouts.html,Ohio student suspended for staying in class during National Walkout Day,Fake_news,0
politifact13806,urbanintellectuals.com/2013/05/07/nra-president-jim-porter-its-only-a-matter-of-time-before-we-can-own-colored-people-again/,"NRA President Jim Porter Falsely Accused of Saying, “It’s Only A Matter Of Time Before We Can Own Colored People Again”",Fake_news,0
politifact200,http://www.cdc.gov/nchs/data/hestat/prelimbirths05_tables.pdf#1,Resource Not Available,Good_news,1
politifact14064,http://www.politifact.com/truth-o-meter/statements/2016/jan/21/donald-trump/donald-trump-exaggerates-when-he-says-china-has-to/,Donald Trump exaggerates when he says China has 'total control' over North Korea,Good_news,1
politifact11416,http://www.politifact.com/truth-o-meter/statements/2015/jul/10/generation-forward-pac/did-bernie-sanders-vote-against-background-checks-/,Did Bernie Sanders vote against background checks and waiting periods for gun purchases?,Good_news,1
politifact14289,www.disclose.tv/australia-becomes-first-country-to-begin-microchipping-its-citizens-313155,Australia Becomes First Country To Begin Microchipping Its Citizens,Fake_news,0
politifact14406,our.news/2017/09/05/trump-orders-13-obama-deep-state-operatives-arrested-for-treason/,Trump Orders 13 Obama Deep State Operatives Arrested For Treason,Fake_news,0
politifact15004,http://econewsmedia.org/2018/02/01/nfl-lawyer-claimed-super-bowl-rigged-found-dead/,"NFL Lawyer, Who Claimed Super Bowl Is ‘Rigged’, Found Dead",Fake_news,0
politifact12052,https://www.washingtonpost.com/news/the-fix/wp/2016/03/10/the-cnn-miami-republican-debate-transcript-annotated/,"The CNN Miami Republican debate transcript, annotated",Good_news,1
politifact14770,newsfeedobserver.com/2-million-rounds-of-ammo-that-went-missing-under-obama-turns-up-in-enemy-hands/,BREAKING: 2 Million Rounds Of Ammo That ‘Went Missing’ Under Obama Turns Up In Enemy Hands,Fake_news,0
politifact14070,https://democrats-oversight.house.gov/sites/democrats.oversight.house.gov/files/documents/DIA%20to%20OGR%20unclassified%20cover%20letter.pdf,letter to Chaffetz and Cummings,Good_news,1
politifact8838,http://www.politifact.com/truth-o-meter/statements/2011/mar/15/barack-obama/barack-obama-says-us-oil-production-last-year-was-/,Barack Obama says U.S. oil production last year was highest since 2003,Good_news,1
politifact1201,http://www.msnbc.msn.com/id/32935603/ns/meet_the_press/page/3/,"Outlook, Office, Skype, Bing, Breaking News, and Latest Videos",Good_news,1
politifact150,http://www.doe.mass.edu/mcas/naep/results/default.html,Massachusetts Department of Elementary and Secondary Education,Good_news,1
politifact186,https://web.archive.org/web/20070706232742/http://vote-smart.org/issue_rating_category.php?can_id=22003,Interest Group Ratings,Good_news,1
politifact3919,http://www.nytimes.com/2011/06/10/opinion/10krugman.html?partner=rssnyt&emc=rss,Rule by Rentiers,Good_news,1
politifact14207,www.higherperspectives.com/powerful-note-1645303283.html,Keanu Reeves Shook The World With Another POWERFUL Message,Fake_news,0
politifact6871,http://www.cnn.com/2012/10/03/politics/debate-transcript/index.html,Transcript of Wednesday's presidential debate,Good_news,1
politifact528,https://web.archive.org/web/20080514182038/http://johnmccain.com/climatechange/,John McCain for President,Good_news,1
politifact1135,https://web.archive.org/web/20090816153543/http://www.whitehouse.gov:80/blog/The-Return-of-the-Viral-Email,The Return of the Viral Email,Good_news,1
politifact690,https://web.archive.org/web/20081204120104/http://www.haysresearch.com/oc072508.htm,Survey Results from Hays Research Group,Good_news,1
politifact671,https://web.archive.org/web/20080828144739/http://www.demconvention.com/joe-biden/,Democratic National Convention,Good_news,1
politifact780,http://www.politifact.com/truth-o-meter/statements/528/,McCain spoke up early,Good_news,1
politifact14498,https://twitter.com/ladygaga/status/795344556908683264?ref_src=twsrc%5Etfw&ref_url=http%3A%2F%2Fwww.snopes.com%2Flady-gagas-arrested-for-twitter-attack-on-melania-trump%2F,Lady Gaga on Twitter,Fake_news,0
politifact10731,http://triblive.com/politics/politicalheadlines/8147758-74/bush-terrorism-florida#axzz3XO3B7Cm9,"Call 'Islamic terrorism' what it is: a threat to West, Jeb Bush says",Good_news,1
politifact15100,http://politicsdepot.com/2018/02/28/kushner-and-wife-ivanka-trump-were-tossed-out-of-the-white-house/,Kushner And Wife Ivanka Trump Were Tossed Out Of The White House — And Donald Is Cutting Them Out Of His Will!,Fake_news,0
politifact499,http://thomas.loc.gov/cgi-bin/bdquery/z?d104:s.01591:,"S.1591 - 104th Congress (1995-1996): A bill to prohibit campaign expenditures for services of lobbyists, and for other purposes.",Good_news,1
politifact340,http://www.msnbc.msn.com/id/3080247/,"Outlook, Office, Skype, Bing, Breaking News, and Latest Videos",Good_news,1
politifact13608,http://majorthoughts.com/chines-restaurant-in-coral-spring-florida-got-busted-for-selling-dog-meat-as-special-menu/,majorthoughts.com,Fake_news,0
politifact503,http://thehill.com/leading-the-news/have-you-been-to-iraq--76-sens.-say-they-have-2007-08-01.html,Have You Been to Iraq — 76 Sens Say They Have by Patrick Fitzgerald,Good_news,1
politifact3304,http://legis.wisconsin.gov/2011/data/JR1SB-11.pdf,2011-2012 Wisconsin Legislature Documents,Good_news,1
politifact2208,https://web.archive.org/web/20090503050002/http://www.google.com/url?sa=t,Redirect Notice,Good_news,1
politifact13771,https://web.archive.org/web/20170214153057/http://uspoln.com:80/2017/02/07/john-hagee-god-made-lesbians-flat-identified-normal-people-easily-2,John Hagee Calls For “Prosecuting Women Who Say God’s Name During Intercourse”,Fake_news,0
politifact14490,http://disaster.trendolizer.com/2017/08/breaking-news-prince-william-and-harry-donates-100-million-to-hurricane-harvey-victims.html,BREAKING NEWS: Prince William and Harry donates $100 million to Hurricane Harvey Victims,Fake_news,0
politifact13855,https://web.archive.org/web/20170313220530/https://www.whitehouse.gov/the-press-office/2017/03/13/remarks-president-trump-listening-session-healthcare,Remarks by President Trump in a Listening Session on Healthcare,Good_news,1
politifact15049,http://yournewswire.com/melanic-trump-exorcist-white-house/,Melania Trump Hired Exorcist To ‘Cleanse White House Of Obama Demons’,Fake_news,0
politifact14992,http://www.trainnews.info/2018/01/rep-paul-gosar-asks-capitol-police-to.html,Rep. Paul Gosar Asks Capitol Police to Arrest Illegal Immigrants Attending State of the Union,Fake_news,0
politifact14169,https://web.archive.org/web/20170528095037/http://uspoln.com:80/2017/05/23/rubio-rape-victims-custody-suspicion-theyre-planning-abortion/,Rubio: “Rape Victims Should Be In Custody If There Is Suspicion That They’re Planning Abortion”,Fake_news,0
politifact2139,http://abcnews.go.com/ThisWeek/week-transcript-geithner/story?id=11245464&page=2,'This Week' Transcript: Geithner,Good_news,1
politifact357,https://web.archive.org/web/20071016232328/http://frontpagemagazine.com:80/Articles/Read.aspx?GUID=5541E159-6AD5-4CC9-B24D-38374624608C,FrontPage Magazine,Good_news,1
politifact1026,https://web.archive.org/web/20090514023215/http://republicanleader.house.gov/News/DocumentSingle.aspx?DocumentID=125333,House GOP Introduces Keep Terrorists Out of America Act,Good_news,1
politifact4069,http://www.whitehouse.gov/the-press-office/2011/07/06/remarks-president-twitter-town-hall,Remarks by the President in Twitter Town Hall,Good_news,1
politifact14644,www.usacarry.com/forums/politics-and-news/62210-hrc-caught-tape-laughing-about-irma-wiping-out-all-those-florida-hillbillies.html,HRC Caught On Tape Laughing About Irma Wiping Out All Of Those Florida Hillbillies,Fake_news,0
politifact14005,http://now8news.com/united-airlines-flight-attendant-slaps-crying-baby/,United Airlines Flight Attendant Slaps Crying Baby During Flight,Fake_news,0
politifact13731,http://theseattletribune.com/idaho-mother-sentenced-prison-multiple-citations-public-breastfeeding/,Information for the Nation,Fake_news,0
politifact14908,http://www.someonesbones.com/blog/delta-force-raids-obama-stronghold-in-thailand/,Delta Force Raids Obama Stronghold in Thailand,Fake_news,0
politifact1204,http://select.nytimes.com/gst/abstract.html?res=FB0E1FF93C58167A93C6AB178CD85F418385F9,"IMPEACHMENT HINT STIRS HOUSE CLASH; Democratic Orators Spring to Roosevelt Defense, Charging 'Malice.'",Good_news,1
politifact15018,http://www.lovethispic.com/blog/44703/smoking-in-cars-with-children-is-illegal-starting--january-30%2C-2018,"Smoking In Cars With Children Is Illegal Starting January 30, 2018",Fake_news,0
politifact3192,http://www.youtube.com/watch?v=hWi7JI55G-c&feature=player_embedded,"""Give Me a Break"" Americans Against Food Taxes TV Ad 2011",Good_news,1
politifact409,http://www.mtv.com/news/articles/1583539/20080317/id_0.jhtml,"Bill Clinton Says He 'Never Said A Bad Word About Senator Obama,' At mtvU's First 'Editorial Board'",Good_news,1
politifact4306,http://www.nytimes.com/2011/08/15/opinion/stop-coddling-the-super-rich.html,Stop Coddling the Super-Rich,Good_news,1
politifact14328,https://web.archive.org/web/20170702174006/http://freedomcrossroads.us:80/malia-obama-fired-from-cushy-internship-at-spanish-embassy,Malia Obama Fired From Cushy Internship At Spanish Embassy,Fake_news,0
politifact5690,http://www.whitehouse.gov/the-press-office/2012/04/03/remarks-president-associated-press-luncheon,Remarks by the President at the Associated Press Luncheon,Good_news,1
