id,news_url,Title_news,Annotations,annotations_num1
politifact14247,https://worldnewsdailyreport.com/chinese-lunar-rover-finds-no-evidence-of-american-moon-landings/,Chinese Lunar Rover Finds No Evidence Of American Moon Landings,Fake_news,0
politifact14404,gloria.tv/video/yRrtUtTCfPga6cq2VDJPcgQe4,Putin says: ‘Pope Francis Is Not A Man Of God’ | Must-See !!,Fake_news,0
politifact15190,http://time.com/5161034/florida-school-shooting-survivor/,Student Hasn't Stopped Filming Since Florida School Shooting,Fake_news,0
politifact11899,https://www.washingtonpost.com/news/the-fix/wp/2016/02/11/transcript-the-democratic-debate-in-milwaukee-annotated/,"Transcript: The Democratic debate in Milwaukee, annotated",Good_news,1
politifact13744,actionnetwork.org/petitions/urgent-new-law-would-charge-protesters-with-terrorism/,URGENT: proposed law would charge protesters with terrorism,Fake_news,0
politifact15129,http://www.trendolizer.com/2017/10/actress-jennifer-aniston-me-and-all-the-trump-supporter-celebrities-decide-to-make-a-company-named-c.html,"Actress Jennifer Aniston: “Me and All The Trump Supporter Celebrities Decide To Make A Company Named “Celebrities For Trump”, Which Fight Against All Anti Trump Celebrities, I Think President Trump Ne",Fake_news,0
politifact15201,http://www.whathappensintheusa.com/trey-gowdy-breaks-his-silence-after-2-of-his-investigators-are-found-tortured-and-killed/,Trey Gowdy Breaks His Silence After 2 Of His Investigators Are Found Tortured And Killed…,Fake_news,0
politifact423,https://web.archive.org/web/20080506120114/http://pol.moveon.org:80/mccain10/email.html?,MoveOn.org Political Action: 10 things to know about McCain,Good_news,1
politifact14119,https://web.archive.org/web/20170521002626/http://dailyusaupdate.com:80/breaking-fox-star-tucker-carlson-critical-condition-head-collision-driving-home,BREAKING: Fox Star Tucker Carlson In Critical Condition After Head On Collision Driving Home,Fake_news,0
politifact98,http://nymag.com/news/features/34992/,Encounters With 'Regular Guy' Fred Thompson -- New York Magazine,Good_news,1
politifact3581,http://politifact.com/truth-o-meter/statements/2009/nov/11/sean-hannity/hannity-says-obama-wont-even-use-term-war-terroris/,"Hannity says Obama won't even use the term ""war on terrorism""",Good_news,1
politifact15204,http://www.projectrepublictoday.com/2018/03/28/emma-gonzalez-bullied-school-shooter-isnt-sorry-then-retweets-message-blaming-white-boys-entitlement-as-cause-of-all-school-shootings/,"Emma Gonzalez Bullied School Shooter, Isn’t Sorry; Then Retweets Message Blaming “White Boys’ Entitlement” As Cause Of All School Shootings",Fake_news,0
politifact15423,http://usbreakingnews.net/bombshell-obama-paid-fbi-informant-over-1-million-to-do-it-to-trump-even-after-the-election/,BOMBSHELL!! Obama Paid FBI Informant Over $1 MILLION To Do It To Trump! EVEN AFTER THE ELECTION!,Fake_news,0
politifact13130,http://crime.chicagotribune.com/chicago/shootings/,Crime in Chicago: Explore your community,Good_news,1
politifact329,https://web.archive.org/web/20080131000131/http://www.barackobama.com/2008/01/30/remarks_of_senator_barack_obam_45.php,Change We Can Believe In,Good_news,1
politifact15347,http://www.mysterious-times.com/2018/04/30/bill-gates-outlines-2018-plan-to-depopulate-the-planet/,Bill Gates Outlines 2018 Plan To Depopulate The Planet,Fake_news,0
politifact4088,http://www.nytimes.com/2011/07/11/opinion/11krugman.html?ref=opinion,"No, We Can’t? Or Won’t?",Good_news,1
politifact546,https://web.archive.org/web/20080619025707/http://www.tampabay.com:80/news/politics/elections/article628630.ece,"In reversal, McCain says lift ban on offshore drilling",Good_news,1
politifact486,http://www.youtube.com/watch?v=uViQ0hVV57Q,John Hagee discusses Catholic Church,Good_news,1
politifact15161,https://www.youtube.com/watch?v=ykoOLSlzuEc,"Florida Bridge Collapse, Female Company",Fake_news,0
politifact9691,http://www.nbcnews.com/politics/first-read/impeachment-talk-becomes-cynical-game-n168436,Impeachment Talk Becomes a Cynical Game,Good_news,1
politifact13541,http://freedomdaily.com/obama-led-u-n-has-just/,BREAKING ObamaLed UN Has Just Made It Official US To Immediately Pay Blacks ‘Reparations’,Fake_news,0
politifact4411,http://cq.com/doc/newsmakertranscripts-3933400,Transcript of Republican Presidential debate at the Ronald Reagan Library in Simi Valley,Good_news,1
politifact14841,https://web.archive.org/web/20171213122934/http://nofakenews.online/update-van-full-of-illegals-caught-voting-at-multiple-alabama-polling-locations/,UPDATE: Van Full Of Illegals Caught Voting At Multiple Alabama Polling Locations,Fake_news,0
politifact14421,http://www.rearfront.com/about-us/, accessed Aug 11,Fake_news,0
politifact13775,http://beforeitsnews.com/opinion-conservative/2016/05/target-to-discontinue-sale-of-holy-bible-3139296.html,Target to Discontinue Sale of Holy Bible,Fake_news,0
politifact6612,http://www.brighthorizons.com/about/aboutbh.aspx,About Bright Horizons Child Care & Family Solutions,Good_news,1
politifact14043,https://web.archive.org/web/20170426151139/http://ilovenativeamericans.us/2017/04/25/trump-wants-to-deport-american-indians-to-india/,TRUMP WANTS TO DEPORT AMERICAN INDIANS TO INDIA,Fake_news,0
politifact69,http://thomas.loc.gov/cgi-bin/query/z?c106:H.R.2122:,Text - H.R.2122 - 106th Congress (1999-2000): Mandatory Gun Show Background Check Act,Good_news,1
politifact14123,https://web.archive.org/web/20170508145802/http://americanflavor.news:80/2017/05/02/just-barack-obama-arrested-japanese-drug-bust,JUST IN: Barack Obama ARRESTED in a Japanese Drug Bust,Fake_news,0
politifact1488,http://abcnews.go.com/print?id=9818034,'This Week' Transcript: Former Vice President Dick Cheney,Good_news,1
politifact214,https://web.archive.org/web/20071206011805/http://www.hillaryclinton.com/news/release/view/?id=4479,HillaryClinton.com,Good_news,1
politifact14932,https://web.archive.org/web/20180118003203/https://threpublican.com/first-indictment-issued-in-russian-bribery-case-tied-to-obama-era-uranium-one-deal/,First Indictment Issued In Russian Bribery Case Tied To Obama-Era Uranium One Deal,Fake_news,0
politifact8045,http://www.cq.com/doc/newsmakertranscripts-4315109,Reps Cummings and Cole Interviewed on MSNBC,Good_news,1
politifact15097,https://www.cpsc.gov/Recalls/2017/target-recalls-water-absorbing-toys,Target Recalls Water Absorbing Toys Due to Serious Ingestion Hazard,Fake_news,0
politifact1028,http://documents.nytimes.com/justice-department-memos-on-interrogation-techniques#p=85,Justice Department Memos on Interrogation Techniques,Good_news,1
politifact5276,http://americaneedsmitt.com/blog/2011/11/10/mit-romney-stage/,子供たちのコト。私のコト。,Good_news,1
politifact4875,http://www.whitehouse.gov/the-press-office/2011/11/30/remarks-president-american-jobs-act-0,Remarks by the President on the American Jobs Act,Good_news,1
politifact14698,https://web.archive.org/web/20171101100601/http://www.snapusanews.com:80/morgan-freeman-jailing-hillary-best-way-to-restore-public-faith-in-govt/,Morgan Freeman: ‘Jailing Hillary’ Best Way To ‘Restore Public Faith In Govt’,Fake_news,0
politifact3734,http://www.whitehouse.gov/the-press-office/2011/05/10/remarks-president-comprehensive-immigration-reform-el-paso-texas,"Remarks by the President on Comprehensive Immigration Reform in El Paso, Texas",Good_news,1
politifact9151,http://www.foxnews.com/on-air/fox-news-sunday-chris-wallace/2014/04/06/sen-kaine-rep-mccaul-security-stateside-military-bases-gen-hayden-reacts-morells-benghazi,Fox News Sunday,Good_news,1
politifact772,"https://web.archive.org/web/20081006202026/http://abcnews.go.com:80/Politics/Decision2008/story?id=3498294,",ABC News: ABC News,Good_news,1
politifact15189,http://viralactions.com/80-of-black-men-in-atlanta-are-homosexuals-study-says/,"80% of black men in Atlanta are Homosexuals, study says",Fake_news,0
politifact825,https://web.archive.org/web/20081030004908/http://www.plannedparenthoodaction.org/campaigns/386.htm,Planned Parenthood® Action Center,Good_news,1
politifact356,https://web.archive.org/web/20070105024255/http://www.focusonthefamily.com:80/press/focusvoices/A000000025.cfm,Dr. James Dobson,Good_news,1
politifact4028,http://nobelprize.org/nobel_prizes/peace/laureates/,All Nobel Peace Prizes,Good_news,1
politifact998,https://web.archive.org/web/20090425195727/http://republicanleader.house.gov:80/News/DocumentSingle.aspx?DocumentID=123296,Debt Day: A Symbol of Washington’s Arrogant Culture of Borrowing and Spending (Boehner Op-Ed on Townhall.com),Good_news,1
politifact5439,http://www.youtube.com/watch?feature=player_embedded&v=07FSu0mHYSg,Rick Santorum sworn in as Pennsylvania’s newest senator,Good_news,1
politifact15141,https://nowtrump.com/2018/03/breaking-supreme-court-sides-with-trump-this-changes-everything/,BREAKING: Supreme Court Sides With Trump–This Changes Everything!,Fake_news,0
politifact13420,https://youtu.be/EiZW41bVF9I,Las Vegas campaign rally,Good_news,1
politifact14795,https://web.archive.org/web/20171027105356/http://www.religionmind.com:80/2017/10/saudi-arabia-behead-6-school-girls-for.html,Saudi Arabia to Behead 6 School Girls for Being With Their Male Friends Without Parents or a Guardian,Fake_news,0
politifact15342,https://yournewswire.com/bill-gates-doctor-vaccinate/,Bill Gates’ Former Doctor Says Billionaire ‘Refused To Vaccinate His Children’,Fake_news,0
politifact14475,http://wrpm33.com/celebrity/what-adam-sandler-is-saying-about-mormons-6/, What Adam Sandler is saying about Mormons,Fake_news,0
politifact15532,http://wesupportdonaldtrump.com/mexico-next-president-invasion-1-a/,MEXICO’S NEXT PRESIDENT Calls for An Invasion Of The US….,Fake_news,0
politifact14361,http://www.businessinsider.com/celebrities-move-to-canada-if-donald-trump-becomes-president-2016-11,9 celebrities who say they'll move to Canada if Donald Trump becomes president,Fake_news,0
politifact65,http://www.senate.gov/legislative/LIS/roll_call_lists/roll_call_vote_cfm.cfm?congress=105&session=1&vote=00055,U.S. Senate: U.S. Senate Roll Call Votes 105th Congress,Good_news,1
politifact12773,https://www.washingtonpost.com/news/post-politics/wp/2016/06/13/hillary-clintons-speech-following-the-orlando-shooting/,‘Americans need to stand together’: Hillary Clinton’s remarks following the Orlando shooting,Good_news,1
politifact5659,http://www.whitehouse.gov/the-press-office/2012/03/29/remarks-president-oil-and-gas-subsidies,Remarks by the President on Oil and Gas Subsidies,Good_news,1
politifact13087,https://www.stlouisfed.org/~/media/Files/PDFs/publications/pub_assets/pdf/itb/2014/In%20the%20Balance%20June%20issue%208.pdf,Hispanic Populations Share of Wealth Likely to Increase by 2025,Good_news,1
politifact13477,http://rare.us/story/rand-paul-will-donald-trump-betray-voters-by-hiring-john-bolton/,Rand Paul: Will Donald Trump betray voters by hiring John Bolton?,Good_news,1
politifact385,http://www.nytimes.com/2008/03/03/us/politics/03campaign.html?ref=politics,Strong Words in Ohio as Obama and Clinton Press On,Good_news,1
politifact8995,http://www.documentcloud.org/documents/1033869-waronpoverty50.html#document/p2,WarOnPoverty50,Good_news,1
politifact14225,http://video.foxnews.com/v/5467929100001/?#sp=show-clips,Ivanka Trump: Father feels 'vindicated' after Comey hearing,Good_news,1
politifact2815,http://www.cbsnews.com/htdocs/pdf/FTN_111410.pdf?tag=cbsnewsTwoColUpperPromoArea,and Surpluses or Deficits as Percentages of GDP 1930–2015,Good_news,1
politifact100,http://thomas.loc.gov/cgi-bin/bdquery/z?d103:HR01025:%7CTOM:/bss/d103query.html,H.R.1025 - 103rd Congress (1993-1994): Brady Handgun Violence Prevention Act,Good_news,1
politifact6146,https://web.archive.org/web/20120619023435/http://www.foxnews.com/on-air/fox-news-sunday/2012/06/17/david-plouffe-sen-joe-lieberman-and-gen-michael-hayden-talk-national-security-leaks?page=3,"David Plouffe, Sen. Joe Lieberman and Gen. Michael Hayden talk national security leaks",Good_news,1
politifact548,https://web.archive.org/web/20081006131457/http://www.politifact.com:80/truth-o-meter/mccainpledge/,Pledge of Allegiance E-mail,Good_news,1
politifact1435,https://web.archive.org/web/20081029143250/http://www.taxpolicycenter.org/numbers/displayatab.cfm?Docid=2007,"Impact of Senator Obama's Tax Proposals as Described by Economic Advisors on Workers, Distribution of Federal Tax Change by Cash Income Percentile, 2009",Good_news,1
politifact834,https://web.archive.org/web/20081202093502/http://afp.google.com:80/article/ALeqM5i2cTbnZTDVHPcifBpEzmkfqOOtlg,AFP: McCain renews attacks on Obama links to radical,Good_news,1
politifact8470,http://sotu.blogs.cnn.com/2013/10/27/rebooting-you-and-your-doctor-under-obamacare/,Rebooting: You and your doctor under Obamacare,Good_news,1
politifact13484,https://www.washingtonpost.com/graphics/politics/2016-election/write-in-votes/,Thinking about writing in a candidate on Election Day? Read this before you do.,Fake_news,0
politifact14620,gunrights.trendolizer.com/2017/10/jason-aldean-gig-canceled-after-he-sells-out-to-liberals-on-snl---breaking.html,Jason Aldean Gig Canceled After He Sells Out To Liberals On SNL,Fake_news,0
politifact14984,http://www.nfib-sbet.org/,National Federation of Independent Business,Good_news,1
politifact2131,http://www.msnbc.msn.com/id/38384219/ns/meet_the_press-transcripts,"Outlook, Office, Skype, Bing, Breaking News, and Latest Videos",Good_news,1
politifact14733,http://www.proxywhore.com/invboard/index.php?/topic/345914-update-malia-obama-among-10-arrested-in-racist-antifa-attack/,UPDATE: Malia Obama Among 10 Arrested In Racist Antifa Attack,Fake_news,0
politifact10276,http://www.c-span.org/video/?322914-1/senator-charles-schumer-dny-november-midterm-elections,"Senator Charles Schumer NY November Midterm Elections, Nov 25 2014",Good_news,1
politifact14052,www.firstpost.com/world/donald-trump-to-issue-an-executive-order-to-ban-facebook-across-us-3363348.html,Donald Trump to issue an executive order to ban Facebook across US,Fake_news,0
politifact15419,http://jumboreport.com/hillary-clinton-furious-at-special-gift-melania-trump-sent-her-from-her-hospital-bed/,Hillary Clinton Furious At ‘Special Gift’ Melania Trump Sent Her From Her Hospital Bed,Fake_news,0
politifact15487,http://redstatewave.com/article.asp?id=128635,BREAKING: Mike Huckabee Just Fired!,Fake_news,0
politifact14667,https://www.facebook.com/StopDjTrump/photos/a.1842244866045369.1073741828.1842223682714154/1969037260032795/?type=3&theater, Wake Up America,Fake_news,0
politifact655,https://web.archive.org/web/20081022203056/http://www.plannedparenthoodaction.org/campaigns/john-mccain-his-own-words-135.htm,Planned Parenthood® Action Center,Good_news,1
politifact497,http://www.youtube.com/watch?v=ljVB-tim2Rw,Obama Criticizes McCain on Lobbyists,Good_news,1
politifact13766,http://ladylibertysnews.com/muslims-offended-kids-recite-national-anthem-claim-racist-force/,Radical Muslims in Australia OFFENDED That Their Children Have to Sing the National Anthem,Fake_news,0
politifact13687,http://politicot.com/mike-pence-allowing-rape-victims-abortions-will-lead-women-trying-get-raped/,Mike Pence: “Allowing Rape Victims To Have Abortions Will Lead To Women Trying To Get Raped”,Fake_news,0
politifact323,https://web.archive.org/web/20080131000131/http://www.barackobama.com/2008/01/30/remarks_of_senator_barack_obam_45.php,Change We Can Believe In,Good_news,1
politifact14309,https://notallowedto.com/great-white-shark-in-great-lakes/,"3,000-Pound Great White Shark Captured in Great Lakes",Fake_news,0
politifact435,http://transcripts.cnn.com/TRANSCRIPTS/0804/13/se.01.html,Transcripts,Good_news,1
politifact13751,https://web.archive.org/web/20170310140734/http://www.learnprogress.org/trump-caught-investing-pipeline/,BREAKING: Trump Caught INVESTING in Dakota Pipeline Before Signing It,Fake_news,0
politifact1314,http://clerk.house.gov/evs/2009/roll884.xml,roll call on Stupak amendment,Good_news,1
politifact8069,http://www.whitehouse.gov/the-press-office/2013/07/24/remarks-president-economy-knox-college-galesburg-il,"Remarks by the President on the Economy -- Knox College, Galesburg, IL",Good_news,1
politifact1177,http://frwebgate.access.gpo.gov/cgi-bin/getdoc.cgi?dbname=111_cong_bills&docid=f:h3200ih.txt.pdf,Browse Congressional Bills,Good_news,1
politifact52,https://web.archive.org/web/20071102131244/http://vote-smart.org:80/issue_rating_category.php?can_id=9490,Interest Group Ratings,Good_news,1
politifact1337,http://www.cbo.gov/ftpdocs/107xx/doc10731/Reid_letter_11_18_09.pdf,Patient Protection and Affordable Care Act,Good_news,1
politifact15014,speedtalk.com/forum/viewtopic.php?t=51650,BREAKING: First NFL Team Declares Bankruptcy Over Kneeling Thugs,Fake_news,0
politifact14499,http://theeconomiccollapseblog.com/archives/hurricane-irma-if-there-was-such-a-thing-as-a-category-6-hurricane-this-would-be-it,"Hurricane Irma: If There Was Such A Thing As A Category 6 Hurricane, This Would Be It",Fake_news,0
politifact15477,https://web.archive.org/web/20180605205653/https://thefederalistpapers.org/us/new-law-illegal-to-shower-and-do-laundry-on-same-day,New Law Makes it Illegal to Shower and Do Laundry on Same Day,Fake_news,0
politifact13999,https://web.archive.org/web/20170412155326/http://southernconservativextra.com:80/thall/texas-law-enforcement-officer-fatally-shot-upon-arriving-for-work-by-3-muslim-refugee-do-you-support-to-deport-them,Texas law enforcement officer fatally shot upon arriving for work by 3 Muslim refugee. Do you support to deport them?,Fake_news,0
politifact4879,http://www.unionleader.com/article/20111129/OPINION02/711299993,"Rick Santorum: By amending constitution, we can balance the budget for good",Good_news,1
politifact567,https://web.archive.org/web/20080709210822/http://johnmccain.com/Informing/News/PressReleases/26d74083-c92b-44e9-9600-4e3c30b9a3fb.htm,John McCain for President,Good_news,1
politifact11747,http://data.bls.gov/timeseries/CES0500000001?output_view=net_1mth,Bureau of Labor Statistics Data,Good_news,1
politifact10332,http://sotu.blogs.cnn.com/2014/12/21/obama-gitmo-inspires-jihadists/,Obama: Gitmo inspires jihadists,Good_news,1
politifact1202,https://web.archive.org/web/20090919163055/http://www.whitehouse.gov/the_press_office/Remarks-by-the-First-Lady-on-What-Health-Insurance-Reform-Means-for-Women-and-Families/,Remarks by the First Lady on What Health Insurance Reform Means for Women and Families,Good_news,1
politifact13058,http://www.cq.com/doc/newsmakertranscripts-4953962?9,remarks in Philadelphia,Good_news,1
politifact14597,http://dailyfeed.news/flight-crew-takes-a-knee-and-walks-off-leaving-new-orleans-saints-stranded-on-runway/,"Flight Crew Takes A Knee And Walks Off, Leaving New Orleans Saints Stranded On Runway",Fake_news,0
politifact13468,http://www.bbc.com/news/election-us-2016-37987306?ocid=socialflow_twitter,Denzel Washington hit by Facebook fake news story on Trump,Fake_news,0
politifact12411,https://iqmediacorp.com/ClipPlayer/?ClipID=76bcc57c-2250-4061-8cd2-b2996a9541c2,iQ media Clip Player,Good_news,1
politifact12057,http://www.nbcnews.com/video/ted-cruz-full-meet-the-press-interview-643057731924,Ted Cruz' Full 'Meet the Press' Interview,Good_news,1
politifact15453,https://www.sasse.senate.gov/public/index.cfm/press-releases?ID=BB3AAE5D-F593-4228-9008-C6BCC8D3FC2B,Sasse Statement on Trade War,Good_news,1
politifact377,http://www.nytimes.com/2008/02/26/us/politics/26text-debate.html?_r=1&adxnnl=1&oref=slogin&pagewanted=all&adxnnlx=1204139772-dnxW+xyD4n9RmqZLgdQ3Ig,The Democratic Debate in Cleveland,Good_news,1
politifact14837,mightynest.com/learn/research-by-concern/dangers-of-triclosan, If You Are Using This Toothpaste… Throw It Away Immediately Nov 28,Fake_news,0
politifact4177,http://thomas.loc.gov/cgi-bin/query/D?c108:5:./temp/%7Ec108Feg4Je::,Library of Congress,Good_news,1
politifact13912,https://web.archive.org/web/20170315011720/http://thelastlineofdefense.org/breaking-president-trump-just-told-paul-ryan-youre-fired/,BREAKING: President Trump Just Told Paul Ryan ‘You’re Fired’,Fake_news,0
politifact14408,http://dailynative.us/tornado-carries-mobile-home-130-miles-family-inside-unharmed/,dailynative.us,Fake_news,0
politifact15540,http://houstonpost.co/2018/06/26/red-hen-owner-just-issued-sick-threat-to-sarah-sanders-after-biz-was-destroyed-by-booting-her/,Red Hen Owner Just Issued Sick Threat To Sarah Sanders After Biz Was Destroyed By Booting Her,Fake_news,0
politifact1424,https://web.archive.org/web/20100125035945/http://republicanleader.house.gov:80/News/DocumentSingle.aspx?DocumentID=167478,"PWNED: House GOP Dominates Twitter, YouTube, Social Media in Congress",Good_news,1
politifact3180,http://abcnews.go.com/Politics/rand-paul-republicans-arent-brave-tackle-deficit/story?id=12837636&page=1,Rand Paul: Republicans 'Aren't Maybe Brave Enough' to Tackle Deficit,Good_news,1
politifact15331,https://dailyworldupdate.us/2018/04/29/cnn-shocks-america-fires-journalist-who-made-fun-of-sarah-sanders-face/,"CNN Shocks America, FIRES ‘Journalist’ Who Made Fun Of Sarah Sanders’ Face",Fake_news,0
politifact14596,http://www.thegatewaypundit.com/2017/09/smoking-gun-san-juan-teamsters-didnt-show-work-distribute-relief-supplies-us-aid-rotting-ports/,SMOKING GUN=> San Juan Teamsters Didn't Show Up for Work to Distribute Relief Supplies,Fake_news,0
politifact13544,www.trendolizer.com/2016/12/breaking-florida-moves-for-full-recount-of-state-over-massive-voter-fraud-details.html,BREAKING: Florida Moves For FULL RECOUNT Of State Over Massive Voter Fraud (DETAILS),Fake_news,0
politifact13897,https://www.huzlers.com/snoop-dogg-arrested-conspiracy-talking-murder-trump-video/,Snoop Dogg Arrested For Conspiracy After Talking About His ‘Murder Trump’ Video,Fake_news,0
politifact245,http://query.nytimes.com/gst/fullpage.html?res=9D00E7DE1E39F930A25754C0A960958260,Missing Teen-Ager Found in New Jersey,Good_news,1
politifact14905,www.newsweek.com/obama-not-trump-may-be-invited-royal-wedding-prince-harry-and-meghan-markle-722899,"Obama, Not Donald Trump, May Be Invited to Royal Wedding of Prince Harry and Meghan Markle",Fake_news,0
politifact14161,https://portalstate.com/index.php/2017/05/08/obama-canceled-it-trump-reinstated-it-a-very-sacred-day-is-back/,"OBAMA CANCELED IT, TRUMP REINSTATED IT – A VERY SACRED DAY IS BACK",Fake_news,0
politifact1454,http://www.msnbc.msn.com/id/35159331/ns/meet_the_press/page/2/,"Outlook, Office, Skype, Bing, Breaking News, and Latest Videos",Good_news,1
politifact1052,https://web.archive.org/web/20090612021235/http://www.talkingpointsmemo.com:80/photofeatures/2009/06/more-czars-than-the-romanovs.php?img=1,More Czars Than the Romanovs,Good_news,1
politifact14008,https://web.archive.org/web/20170415165124/http://thenewyorkevening.com:80/2017/04/10/breaking-malia-obama-expelled-harvard,BREAKING: MALIA OBAMA EXPELLED FROM HARVARD,Fake_news,0
politifact5237,http://www.politifact.com/virginia/statements/2011/mar/11/morgan-griffith/morgan-griffith-says-epa-treats-milk-spills-same-w/,Morgan Griffith says EPA treats milk spills same way as oil spills,Good_news,1
politifact15133,https://www.c-span.org/video/?442305-1/president-trump-campaigns-rick-saccone-pennsylvania&start=180,"President Trump Campaigns Rick Saccone Pennsylvania, Mar 10 2018",Good_news,1
politifact14164,https://web.archive.org/web/20170616171149/https://www.federalisttribune.com/2017/05/10/trump-gives-chaffetz-thumbs-investigating-hillary-clintons-email-server/,Trump Gives Chaffetz The Thumbs Up For Investigating Hillary Clinton’s Email Server,Fake_news,0
politifact14388,https://newsbreakshere.com/nyc-physician-wife-jump-deathleave-kids-behind-cant-afford-health-care-hours-mccain-murkowski-collins-every-democrat-voted,"NYC: PHYSICIAN and Wife Jump To Death…Leave Kids Behind Because They “Can’t Afford The Health Care” Only Hours After McCain, Murkowski, Collins and EVERY Democrat Voted To Keep Obamacare -",Fake_news,0
politifact13136,https://www.washingtonpost.com/news/the-fix/wp/2016/09/26/the-first-trump-clinton-presidential-debate-transcript-annotated/?hpid=hp_rhp-top-table-main_transcript-905pm%3Ahomepage%2Fstory,"The first Trump-Clinton presidential debate transcript, annotated",Good_news,1
politifact13593,https://web.archive.org/web/20161226221619/http://newsdaily12.com:80/rochester-new-hampshire/bill-murray-had-this-to-say-about-rochester-new-hampshire-residents,"Bill Murray Had This to Say About Rochester, New Hampshire Residents – News Daily 12",Fake_news,0
politifact207,http://www.cbo.gov/ftpdocs/45xx/doc4517/09-03-TankerTestimony.pdf,Testimony on CBO’s Assessment of the Air Force’s Plan to Acquire 100 Boeing Tanker Aircraft,Good_news,1
politifact23,http://query.nytimes.com/gst/fullpage.html?res=9402E4D61E3FF93AA25753C1A961958260,RACE FOR CITY HALL: The Republican Candidate; A Mercurial Mayor's Confident Journey,Good_news,1
politifact12944,http://www.cq.com/doc/newsmakertranscripts-4942265?3,comments in Fayetteville NC,Good_news,1
politifact3117,http://www.desmoinesregister.com/article/20100324/OPINION01/3250323/1036,Des Moines Register,Good_news,1
politifact14311,https://www.usnews.com/news/articles/2006/11/07/10-things-you-didnt-know-about-nancy-pelosi,10 Things You Didn't Know About Nancy Pelosi,Fake_news,0
politifact8737,http://www.bls.gov/news.release/jolts.htm,Job Openings and Labor Turnover Survey News Release,Good_news,1
politifact14062,observeronline.news/sarah-palin-coma-hit-run/,JUST IN: Sarah Palin In A Coma After Hit And Run,Fake_news,0
politifact14481,what-you-missed.com/floyd-mayweather-jr-donates-a-whopping-sum-of-money-to-houston-after-hurricane/,Floyd Mayweather Jr. Donates a Whopping Sum of Money to Houston After Hurricane – What You Missed,Fake_news,0
