id,news_url,Title_news,Annotations,annotations_num1
politifact14863,http://pegida.trendolizer.com/2017/10/breaking-illegal-muslim-from-iran-arrested-for-starting-california-wildfire.html,BREAKING: Illegal Muslim From Iran Arrested For Starting California Wildfire,Fake_news,0
politifact9734,https://www.youtube.com/watch?v=AtJWEAj1vZM,Rand Paul Campaigns in Iowa for Miller-Meeks,Good_news,1
politifact445,https://web.archive.org/web/20070513055236/http://www.opensecrets.org/pres08/select.asp?Ind=K02,2008 Presidential Election,Good_news,1
politifact14471,https://web.archive.org/web/20170828162320/http://ourlandofthefree.com:80/2017/08/remember-this-lunatic/,BREAKING: President Trump Pardons Kim Davis,Fake_news,0
politifact14517,http://disaster.trendolizer.com/2017/09/update-florida-governor-rick-scott-now-listed-as-critical-after-bizarre-hurricane-cleanup-accident.html,UPDATE: Florida Governor Rick Scott Now Listed As &#8216;Critical&#8217; After Bizarre Hurricane Cleanup Accident,Fake_news,0
politifact10348,http://www.eia.gov/cfapps/ipdbproject/IEDIndex3.cfm?tid=50&pid=53&aid=1,International Energy Statistics,Good_news,1
politifact568,http://thomas.loc.gov/cgi-bin/bdquery/z?d109:HR06060:,H.R.6060 - 109th Congress (2005-2006): Department of State Authorities Act of 2006,Good_news,1
politifact12120,http://politicaladarchive.org/ad/PolAd_BernieSanders_7h37u/,Political TV Ad Archive » PolAd,Good_news,1
politifact14174,https://twitter.com/DWStweets/status/870250319644676097,Debbie Wasserman Schultz on Twitter,Good_news,1
politifact14666,http://conservative7.com/2017/10/10/breaking-black-hockey-player-fired-raising-fist-national-anthem/,BREAKING: Black Hockey Player FIRED After Raising Fist During National Anthem,Fake_news,0
politifact239,http://www.ed.gov/about/overview/budget/history/index.html,U.S. Department of Education Budget History,Good_news,1
politifact15404,https://dailyworldupdate.us/2018/05/18/breaking-santa-fe-killer-confesses-his-love-for-obama/,BREAKING: Santa Fe Killer Confesses His Love For Obama,Fake_news,0
politifact15301,http://bitcoingrower.life/2018/04/15/apply-now-and-win-the-canada-diversity-immigration-visa-lottery-dv-2019-program-live-and-work-in-canada-insurance-loan-mortgage-tax-laws-mesothelioma/,Account Suspended,Fake_news,0
politifact15187,https://www.washingtonpost.com/news/the-intersect/wp/2018/03/25/a-fake-photo-of-emma-gonzalez-went-viral-on-the-far-right-where-parkland-teens-are-villains/?utm_term=.a8127cdbabea,"A fake photo of Emma González went viral on the far right, where Parkland teens are villains",Fake_news,0
politifact695,http://www.msnbc.msn.com/id/26535811/,"Outlook, Office, Skype, Bing, Breaking News, and Latest Videos",Good_news,1
politifact9622,http://www.whitehouse.gov/the-press-office/2012/06/23/op-ed-president-obama-president-obama-reflects-impact-title-ix,Op-ed by President Obama: President Obama Reflects on the Impact of Title IX,Good_news,1
politifact6932,http://www.politifact.com/ohio/statements/2012/aug/23/barack-obama/barack-obama-says-mitt-romney-condemned-coal-fired/,Barack Obama says Mitt Romney condemned coal-fired power plants as killers,Good_news,1
politifact489,http://www.reuters.com/article/topNews/idUSN0961758520080110,"U.S. considers 3,000 more troops for Afghanistan",Good_news,1
politifact1013,http://www.senate.gov/legislative/LIS/roll_call_lists/roll_call_vote_cfm.cfm?congress=111&session=1&vote=00174,U.S. Senate: U.S. Senate Roll Call Votes 111th Congress,Good_news,1
politifact551,https://web.archive.org/web/20080619050133/http://www.democracynow.org:80/2008/6/18/ralph_nader_on_barack_obama_it,"Ralph Nader on Barack Obama: ""It is Quite Clear He is a Corporate Candidate from A to Z""",Good_news,1
politifact1040,https://web.archive.org/web/20090604101517/http://www.whitehouse.gov/the_press_office/Background-Briefing-on-GM-Restructuring-May-31-2009/,"Background Briefing on GM Restructuring, May 31, 2009",Good_news,1
politifact14839,http://worldnewsdailyreport.com/morgue-employee-cremated-by-mistake-while-taking-a-nap/,Morgue employee cremated by mistake while taking a nap,Fake_news,0
politifact14259,www.usatoday.com/story/news/nation-now/2015/04/28/bumble-bee-foods-tuna-worker-cooked/26517161/,Bumble Bee Foods charged after man cooked with tuna,Fake_news,0
politifact6537,http://www.youtube.com/watch?v=8BTl2pSmpYk&feature=player_embedded,Romney campaign ad,Good_news,1
politifact1446,https://web.archive.org/web/20090910073834/http://www.whitehouse.gov/the_press_office/Remarks-by-the-President-at-AFL-CIO-Labor-Day-Picnic/,Remarks by the President at AFL CIO Labor Day Picnic,Good_news,1
politifact1185,http://www.youtube.com/watch?v=Cqww8jmizug&eurl=http%3A%2F%2Fstoptheabortionagenda.com%2F&feature=player_embedded,Obama Promises Abortion in Public Plan,Good_news,1
politifact206,https://web.archive.org/web/20071020151813/http://capitaleye.org:80/inside.asp?ID=311,Summing Summertime: Part 4,Good_news,1
politifact7923,https://twitter.com/BarackObama/status/347057653089988608,Barack Obama on Twitter,Good_news,1
politifact99,http://www.msnbc.msn.com/id/3080247/,"Outlook, Office, Skype, Bing, Breaking News, and Latest Videos",Good_news,1
politifact13496,http://www.theverge.com/2016/11/25/13748226/cnn-accidentally-airs-porn-fake-news-boston,The CNN porn scare is how fake news spreads,Fake_news,0
politifact13303,https://web.archive.org/web/20161007194921/https://www.dni.gov/index.php/newsroom/press-releases/215-press-releases-2016/1423-joint-dhs-odni-election-security-statement,Joint DHS and ODNI Election Security Statement,Good_news,1
politifact13820,thenationalmarijuananews.com/jimmy-carter-medical-marijuana-cured-my-cancer/,Jimmy Carter: “Medical Marijuana Cured My Cancer”,Fake_news,0
politifact14876,https://web.archive.org/web/20171228111229/http://defense-usa.xyz/2017/12/15/boom-roy-moore-takes-the-military-vote-pulls-ahead-by-5k-votes/,"BOOM: Roy Moore Takes The Military Vote, Pulls Ahead By 5K Votes",Fake_news,0
politifact14327,https://halfwaypost.com/2017/07/06/white-house-chef-quits-because-trump-has-only-eaten-fast-food-for-6-months/,White House Chef Quits Because Trump Has Only Eaten Fast Food For 6 Months,Fake_news,0
politifact341,http://www.youtube.com/watch?v=Yj3QAzSWVA4,Mike Huckabee: Fried Squirrel Out of a Popcorn Popper,Good_news,1
politifact3632,http://www.nytimes.com/2011/04/18/opinion/18krugman.html?_r=3&src=ISMR_HP_LO_MST_FB,Let’s Not Be Civil,Good_news,1
politifact15360,http://realtimepolitics.com/2018/05/06/melania-hit-donald-trump/,Melania Just Hit Donald Trump With Shocking Announcement He Never Saw Coming,Fake_news,0
politifact426,https://web.archive.org/web/20080506120114/http://pol.moveon.org:80/mccain10/email.html?,MoveOn.org Political Action: 10 things to know about McCain,Good_news,1
politifact3198,http://www.politicsdaily.com/2011/02/06/transcript-of-president-obamas-pre-super-bowl-interview-with-bi/,The latest political news and headlines from D.C. and beyond,Good_news,1
politifact14265,https://mainerepublicemailalert.com/2017/06/24/breaking-johnny-depp-taken-into-custody-by-secret-service/,BREAKING: Johnny Depp Taken Into Custody By Secret Service,Fake_news,0
politifact14003,unofficialnetworks.com/2016/09/21/man-loses-his-testicles-after-attempting-to-smoke-weed-through-a-scuba-tank/,Man Loses His Testicles After Attempting To Smoke Weed Through A Scuba Tank,Fake_news,0
politifact15046,http://obama.trendolizer.com/2018/02/michelle-obama-florida-shooting-is-clearly-trumps-fault-these-shootings-are-happening-constantly-sin.html,"Michelle Obama: ‘Florida Shooting Is Clearly Trump’s Fault, These Shootings Are Happening Constantly Since He Became Our President.We Must Protect Our Children From This Tyrant”Do You Support Her?’",Fake_news,0
politifact968,http://www.politico.com/news/stories/0309/20344.html,60 Minutes Transcript,Good_news,1
politifact14144,http://www.fox5dc.com/news/local-news/254852337-story,Family's private investigator: There is evidence Seth Rich had contact with WikiLeaks prior to death,Fake_news,0
politifact14832,http://usamirrornews.com/roy-moores-accuser-arrested-and-charged-with-falsification/,BREAKING: Roy Moore’s Accuser Arrested And Charged With Falsification,Fake_news,0
politifact15564,https://babylonbee.com/news/senate-democrats-demand-supreme-court-nominee-not-be-unduly-influenced-by-u-s-constitution/,Senate Democrats Demand Supreme Court Nominee Not Be Unduly Influenced By U.S. Constitution,Fake_news,0
politifact15159,https://www.nbcnews.com/storyline/charleston-church-shooting/charleston-shooter-dylann-roof-moved-death-row-terre-haute-federal-n749671,Charleston Shooter Dylann Roof Moved to Death Row in Terre Haute Federal Prison,Fake_news,0
politifact14474,https://www.law.cornell.edu/constitution/amendmentxxv,25th Amendment,Good_news,1
politifact15298,http://usalibertypress.com/2018/02/24/with-trump-we-avoided-war-with-russia-and-orwellian-police-state/,Denzel Washington: With Trump we avoided war with Russia and Orwellian Police State,Fake_news,0
politifact14884,empirenews.net/police-discover-meth-lab-in-back-room-of-alabama-walmart/,Police Discover Meth Lab In Back Room of Alabama Walmart,Fake_news,0
politifact2258,https://web.archive.org/web/20100821215324/http://republicans.foreignaffairs.house.gov:80/press_display.asp?id=1583,U.S. House Committee on Foreign Affairs,Good_news,1
politifact7489,https://twitter.com/DWStweets/status/309001535386435584,Debbie Wasserman Schultz on Twitter,Good_news,1
politifact9438,https://web.archive.org/web/20130314224614/http://www.washingtonpost.com/blogs/wonkblog/wp/2013/03/08/everything-you-need-to-know-about-the-drone-debate-in-one-faq/,"Everything you need to know about the drone debate, in one FAQ",Good_news,1
politifact9802,http://time.com/3111474/rand-paul-ferguson-police/,Rand Paul: We Must Demilitarize the Police,Good_news,1
politifact2592,http://latimesblogs.latimes.com/washington/2010/10/christine-odonnell-chris-coons-debate.html,Transcript of debate between Chris Coons and Christine ODonnell,Good_news,1
politifact14754,http://wkrg.com/2017/11/14/curious-robocall-seeks-damaging-information-on-moore/,LISTEN: Curious Robocall Seeks 'Damaging' Information on Moore,Fake_news,0
politifact787,http://www.politifact.com/truth-o-meter/statements/210/,"He says universal, but it's no guarantee",Good_news,1
politifact15304,https://newstarget.com/2016-02-23-usda-approves-slaughterhouses-producing-horse-meat-for-human-consumption.html,USDA approves slaughterhouses producing horse meat for human consumption,Fake_news,0
politifact8259,http://transcripts.cnn.com/TRANSCRIPTS/1309/10/cfr.01.html,Transcripts,Good_news,1
politifact429,http://www.citizenlink.org/focusaction/updates/A000006979.cfm,Family Policy Alliance,Good_news,1
politifact1068,https://web.archive.org/web/20090624230658/http://www.whitehouse.gov/blog/Protecting-Our-Children-from-the-Dangers-of-Smoking/,Protecting Our Children from the Dangers of Smoking,Good_news,1
politifact6173,https://twitter.com/SarahPalinUSA/status/218353507491786752,Sarah Palin on Twitter,Good_news,1
politifact13893,http://flashnewscorner.com/obamas-mother-law-charged-larceny-fraud/,flashnewscorner.com,Fake_news,0
politifact2881,http://abcnews.go.com/ThisWeek/week-transcript-adm-mike-mullen/story?id=12204355&page=2,'This Week' Transcript: Adm. Mike Mullen,Good_news,1
politifact1701,http://abcnews.go.com/ThisWeek/bill-clinton-rush-limbaugh-mistakes-supreme-court-middle/story?id=10406757,"Bill Clinton on Rush Limbaugh, His Mistakes, the Supreme Court and Middle East Peace",Good_news,1
politifact14114,http://www.economist.com/Trumptranscript,Transcript: Interview with Donald Trump,Good_news,1
politifact1614,http://transcripts.cnn.com/TRANSCRIPTS/1003/21/sotu.01.html,Transcripts,Good_news,1
politifact5011,http://www.youtube.com/watch?v=ZVXbiY33TdM&feature=player_embedded,Gore looking to turn idle fans into activists 3year ad campaign will feature enemies united on climate,Good_news,1
politifact246,http://transcripts.cnn.com/TRANSCRIPTS/0706/05/se.01.html,Transcripts,Good_news,1
politifact1375,http://blogs.desmoinesregister.com/dmr/index.php/2009/12/18/grassley-camps-in-office-friday-night-to-make-720-a-m-vote/,The Des Moines Register,Good_news,1
politifact669,https://web.archive.org/web/20080817004723/http://www.cqpolitics.com:80/cq-assets/cqmultimedia/flash/votestudy/index.html,CQ Vote Studies,Good_news,1
politifact14950,https://www.archives.gov/presidential-libraries/about/faqs.html,Frequently Asked Questions,Fake_news,0
politifact4720,http://www.youtube.com/watch?v=EhyMplwY6HY,Romneys ProLife Conversion Myth or Reality June 14,Good_news,1
politifact1924,http://www.radaronline.com/exclusives/2010/06/video-jersey-shore-cast-weathers-storm-sophomore-season-preview,VIDEO: Special Preview Of Jersey Shore In Miami!,Good_news,1
politifact13310,https://www.washingtonpost.com/local/they-say-they-arrived-in-the-us-illegally-now-theyre-working-on-trumps-dc-hotel/2015/07/06/9a785116-20ec-11e5-84d5-eb37ee8eaa61_story.html,"At Trump hotel site, immigrant workers wary",Good_news,1
politifact14794,https://web.archive.org/web/20171127001649/http://dailynewsforamericans.com:80/index.php/2017/11/23/singer-tina-turner-this-thanksgiving-is-the-first-time-in-8-years-that-i-am-thankful-for-our-president-god-bless-him-and-his-supporters-do-you-support-to-tina,"Singer Tina Turner: “This Thanksgiving Is The First Time in 8 Years That I am Thankful For Our President, God Bless Him And His Supporters.” Do You Support To Tina ? – American President Donald J. Tru",Fake_news,0
politifact1892,http://abcnews.go.com/ThisWeek/week-transcript-hoyer-boehner-bill-gates/story?id=10900231,"'This Week' Transcript: Hoyer, Boehner and Bill Gates",Good_news,1
politifact937,https://web.archive.org/web/20080623122709/http://www.sciam.com/article.cfm?id=a-solar-grand-plan,A Solar Grand Plan: Scientific American,Good_news,1
politifact2298,https://web.archive.org/web/20050322064340/http://www6.lexisnexis.com:80/publisher/EndUser?Action=UserDisplayFullDocument,LexisNexis(R) Publisher,Good_news,1
politifact14601,https://web.archive.org/web/20171228144534/http://houstonchronicle-tv.com/the-kardashians-donate-whopping-sum-to-las-vegas-mass-shooting-victims/,The Kardashians donate whopping sum to Las Vegas mass shooting victims,Fake_news,0
politifact1500,https://web.archive.org/web/20100215141959/http://republicanleader.house.gov:80/News/DocumentSingle.aspx?DocumentID=170154,"As Dems’ “Stimulus” Anniversary Nears, Americans Ask: “Where are the Jobs?”",Good_news,1
politifact14395,http://usa24info.com/index.php/2017/11/09/report-kim-jong-un-killed-trumps-overnight-black-op-attack-north-korea/,REPORT: Kim Jong Un Killed In Trump’s Overnight Black Op Attack On North Korea -,Fake_news,0
politifact7259,https://web.archive.org/web/20130116024005/http://www.pbs.org/newshour/bb/social_issues/jan-june13/keene_01-15.html,"NRA President David Keene Rejects White House Gun Control Approach | PBS NewsHour | Jan. 15, 2013",Good_news,1
politifact7595,http://www.foxnews.com/on-air/fox-news-sunday-chris-wallace/2013/03/31/mark-kelly-whether-call-action-gun-control-fading-cardinal-donald-wuerl-new-pope,Fox News Sunday,Good_news,1
politifact15352,https://dailyworldupdate.us/2018/05/01/breaking-hillary-clinton-killed-in-monster-truck-mishap/,BREAKING: Hillary Clinton Killed In Monster Truck Mishap,Fake_news,0
politifact3984,"http://foreign.senate.gov/imo/media/doc/Haass,%20Richard%20N.pdf",Fiscal Year 2011 Email interview with Todd Harrison of the Center for Strategic and Budgetary Assessments,Good_news,1
politifact11577,http://www.cbsnews.com/news/democratic-debate-bernie-sanders-really-isnt-as-socialist-as-president-eisenhower/,"Democratic debate: Bernie Sanders really isn't as ""socialist"" as President Eisenhower",Good_news,1
politifact1047,https://web.archive.org/web/20090612062614/http://www.ustreas.gov:80/press/releases/tg162.htm,TG-162: Treasury Announces $68 Billion in Expected CPP Repayments,Good_news,1
politifact15123,https://www.fda.gov/NewsEvents/Newsroom/PressAnnouncements/ucm598317.htm,"Statement from FDA Commissioner Scott Gottlieb, M.D., on FDA’s ongoing efforts to help improve effectiveness of influenza vaccines",Fake_news,0
politifact1014,http://www.politico.com/news/stories/0509/22413.html,Trump on Prejean: Same as Obama,Good_news,1
politifact9107,http://wfpl.org/post/mitch-mcconnell-alison-lundergan-grimes-have-sharp-differences-campaign-finance-rules,"Mitch McConnell, Alison Lundergan Grimes Have 'Sharp Differences' on Campaign Finance Rules",Good_news,1
politifact339,https://web.archive.org/web/20080213201909/http://facts.hillaryhub.com/archive/?id=4497,The Fact Hub,Good_news,1
politifact14472,http://www.washingtonpost.com/blogs/blogpost/post/hurricane-irene-photo-of-shark-swimming-in-street-is-fake/2011/08/26/gIQABHAvfJ_blog.html,Hurricane Irene: ‘Photo’ of shark swimming in street is fake,Fake_news,0
politifact9033,http://www.youtube.com/watch?v=Vp6x3mEU4ok&list=UUOKW-o3oYdFmrMNcTLVuaoA,3/8/14 Sen. Rob Portman (R-OH) delivers Weekly GOP Address on American jobs,Good_news,1
politifact15147,patrioticviralnews.com/articles/international-arrest-warrant-issued-for-george-soros/,International Arrest Warrant Issued for George Soros,Fake_news,0
politifact310,http://www.senate.gov/legislative/LIS/roll_call_lists/roll_call_vote_cfm.cfm?congress=108&session=1&vote=00196,U.S. Senate: U.S. Senate Roll Call Votes 108th Congress,Good_news,1
politifact581,https://web.archive.org/web/20080717022107/http://www.johnmccain.com/Informing/News/PressReleases/Read.aspx?Guid=e92e0317-02b3-4345-82f9-9eac8bb0a50d,John McCain for President,Good_news,1
politifact14860,http://tmzbreaking.com/law-passed-all-child-support-in-the-united-states-will-end-by-beginning-of-2018/,LAW PASSED: All Child Support in the United States Will End by Beginning of 2018,Fake_news,0
politifact14699,http://www.breakingnews365.net/59f509292adf6/alabama-football-crimson-tide-disqualified-from-national-championship.html,Alabama football Crimson Tide disqualified from national championship,Fake_news,0
politifact943,https://web.archive.org/web/20090224213953/http://www.mcclatchydc.com:80/251/story/62614.html,"Earmark reform? 2009 spending bill contains 9,000 of them",Good_news,1
politifact535,http://politicalticker.blogs.cnn.com/2008/05/05/mccain-touts-gang-of-14-immigration-reform/,"McCain touts 'Gang of 14,' immigration reform",Good_news,1
politifact13501,http://therightists.com/lady-gaga-reveals-plan-to-cover-her-face-again-until-trump-gets-fired-from-office-and-i-feel-free-once-more/,Lady Gaga Reveals Plan To Cover Her Face Again “Until Trump Gets Fired From Office And I Feel Free Once More”,Fake_news,0
politifact14668,http://www.react365.com/59ed36a3cf5bb/tulsa-school-closes-after-brutal-fire.html,Tulsa School closes after brutal fire.,Fake_news,0
politifact14264,https://web.archive.org/web/20170626190612/http://snoopack.com/2017/06/23/just-today-trey-gowdy-new-director-fbi/,JUST IN TODAY: Trey Gowdy Is The NEW DIRECTOR Of The FBI!,Fake_news,0
politifact15534,http://www.thelifebuzz.com/nasa-announced-that-it-communicated-with-four-races-of-aliens/2/,NASA ANNOUNCED THAT IT COMMUNICATED WITH FOUR RACES OF ALIENS,Fake_news,0
politifact12721,https://web.archive.org/web/20150816005009/http://www.hillaryclinton.com:80/briefing/factsheets/2015/07/13/email-facts/,Updated: The Facts About Hillary Clinton’s Emails,Good_news,1
politifact3935,http://www.gpo.gov/fdsys/pkg/CREC-2006-03-16/pdf/CREC-2006-03-16-pt1-PgS2236.pdf,Obama Exclusive Concedes Senate Voteainst Raising Debt Limit Was Political,Good_news,1
politifact1436,https://web.archive.org/web/20091229194623/http://www.bobmcdonnell.com/index.php/press_releases/details/mcdonnell_letter_urges_no_delay_in_virginia_offshore_energy_exploration_and/,McDonnell Letter Urges No Delay in Virginia Offshore Energy Exploration and Development,Good_news,1
politifact15599,http://www.blingnews.com/this-is-amazing-in-1984-the-new-york-times-said-trump-would-be-our-best-presidentthey-forgot/,"THIS IS AMAZING: In 1984, the New York Times said Trump would be our BEST president…They forgot…..",Fake_news,0
politifact10408,http://www.eia.gov/cfapps/ipdbproject/IEDIndex3.cfm?tid=50&pid=53&aid=1,International Energy Statistics,Good_news,1
politifact14731,https://www.flake.senate.gov/public/index.cfm/press-releases?ID=FE6E0D3D-D9AE-4AF2-963B-275C6308D31A,Flake: “Religious tests should have no place in the Senate”,Good_news,1
politifact8005,http://www.cq.com/doc/newsmakertranscripts-4310502,interview on Fox News,Good_news,1
politifact934,http://www.nytimes.com/2009/02/09/us/politics/09text-obama.html?_r=1,Obama’s Prime-Time Press Briefing,Good_news,1
politifact1419,http://frwebgate.access.gpo.gov/cgi-bin/getpage.cgi?position=all&page=H270&dbname=2010_record,speech on the floor of the US House of Representatives,Good_news,1
politifact104,https://web.archive.org/web/20061114035029/http://mccain.senate.gov/press_office/view_article.cfm?id=34,U.S. Senator John McCain,Good_news,1
politifact11072,http://www.foxnews.com/transcript/2015/07/12/mcconnell-webb-jindal-express-uncertainty-over-iran-nuclear-deal/,"McConnell, Webb, Jindal express uncertainty over Iran nuclear deal",Good_news,1
politifact627,http://thecaucus.blogs.nytimes.com/2008/08/15/mccain-in-colorado/,McCain in Colorado,Good_news,1
politifact11066,http://blogs.wsj.com/washwire/2015/07/13/hillary-clinton-transcript-building-the-growth-and-fairness-economy/,Hillary Clinton Transcript: Building the ‘Growth and Fairness Economy’,Good_news,1
politifact1465,https://web.archive.org/web/20100201043706/http://www.whitehouse.gov:80/the-press-office/remarks-president-gop-house-issues-conference,Remarks by the President at GOP House Issues Conference,Good_news,1
politifact2019,http://www.facebook.com/notes/sarah-palin/peace-through-strength-and-american-pride-vs-enemy-centric-policy/403777543434,Peace Through Strength and American Pride vs. “Enemy-Centric” Policy,Good_news,1
politifact5469,http://www.youtube.com/watch?v=TuYCknrJZ7A,White and Blue Fund ad,Good_news,1
politifact13229,https://www.washingtonpost.com/news/post-politics/wp/2016/01/02/donald-trump-featured-in-new-jihadist-recruitment-video/,Donald Trump featured in new jihadist recruitment video,Good_news,1
politifact15138,https://web.archive.org/web/20180210020716/http://www.delta-flying.info:80/?,Delta Ticket 2017,Fake_news,0
politifact13794,https://web.archive.org/web/20170217173139/http://usadailypost.us:80/2017/02/14/breaking-trump-just-gave-every-working-legal-man-woman-child-usa-612,"BREAKING: Trump Just Gave Every WORKING, LEGAL Man Woman And Child In The USA $612 EACH! -",Fake_news,0
politifact8172,http://www.whitehouse.gov/the-press-office/2013/08/06/remarks-president-responsible-homeownership,Remarks by the President on Responsible Homeownership,Good_news,1
politifact12755,http://www.pewforum.org/2008/09/19/pastors-to-protest-irs-rules-on-political-advocacy/,Pastors To Protest IRS Rules on Political Advocacy,Good_news,1
politifact15207,https://me.me/i/laguna-beach-antifa-lagbeachantifa9-22m-david-hogg-didnt-attend-parkland-20703986,Laguna Beach Antifa 22m David Hogg Didn't Attend Parkland High School I Went to School With Him at Redondo Shores High School in California and He Graduated in 2015 Here He Is in Our Yearbook From 201,Fake_news,0
politifact14694,www.usacarry.com/forums/politics-and-news/62789-update-hillary-clinton-leaves-country-mueller-indictment-announced.html,UPDATE: Hillary Clinton Leaves The Country As Mueller Indictment Is Announced,Fake_news,0
politifact1143,"http://www.foxnews.com/story/0,2933,539893,00.html",Transcript: Blue-Ribbon Panel on Health Care,Good_news,1
politifact13591,http://smag31.com/mom-applies-remedy-baby-moments-later-dies-careful-moms/,"Mom applies a remedy to her baby, moments later he dies. Be careful with this, moms!",Fake_news,0
politifact1315,http://www.cnn.com/2009/US/10/30/guantanamo.h1n1.shots/index.html,H1N1 vaccinations to be offered to Guantanamo Bay detainees,Good_news,1
politifact6998,https://web.archive.org/web/20121023081044/http://www.washingtonpost.com/blogs/ezra-klein/wp/2012/10/22/the-full-transcript-of-the-third-presidential-debate/,The full transcript of the third presidential debate,Good_news,1
politifact336,https://web.archive.org/web/20080206222702/http://www.mittromney.com/News/Press-Releases/Kerry_McCain,Kerry-McCain: Welcome To Massachusetts!,Good_news,1
politifact396,https://web.archive.org/web/20060930180024/http://clinton.senate.gov/news/statements/details.cfm?id=233783,"Hillary Rodham Clinton, Senator for New York: Floor Speech of Senator Hillary Rodham Clinton on S.J. Res. 45, A Resolution to Authorize the Use of United States Armed Forces Against Iraq",Good_news,1
politifact3341,https://web.archive.org/web/20110223135940/http://www.ryannewman.org:80/discussions_display/id-1025,U.S. Army's Involvement in Motorsports,Good_news,1
politifact1118,http://action.citizen.org/campaign.jsp?campaign_KEY=26880,Public Citizen,Good_news,1
politifact14155,http://patriotcrier.com/1-6kk-0/,"BOMBSHELL: COMEY KNEW MURDERED DNC STAFFER, SETH RICH, WAS WIKILEAKS SOURCE & COVERED IT UP FOR HILLARY",Fake_news,0
politifact258,https://web.archive.org/web/20080108202709/https://www.mittromney.com/News/Press-Releases/Ad_Remember,"Romney For President Launches New Television Ad, ""Remember""",Good_news,1
politifact14188,https://web.archive.org/web/20170527174400/http://uspoln.com:80/2017/05/20/trumps-top-scientist-pick-scientists-just-dumb-regular-people-think-dinosaurs-existed-earth-getting-warmer,Trump’s Top Scientist Pick: “Scientists Are Just Dumb Regular People That Think Dinosaurs Existed And The Earth Is Getting Warmer”,Fake_news,0
